path,title,count,uniques,repository
/cristianpb/analytics-google,GitHub - cristianpb/analytics-google: Google analytics from cristianpb.github...,5,5,analytics-google
/cristianpb/analytics-google/blob/master/README.md,analytics-google/README.md at master 路 cristianpb/analytics-google,1,1,analytics-google
/cristianpb/aws-lambda-cv,"cristianpb/aws-lambda-cv: Computer Vision, with AWS Lambda",1,1,aws-lambda-cv
/cristianpb/aws-lambda-cv/blob/master/lambda_function.py,aws-lambda-cv/lambda_function.py at master 路 cristianpb/aws-lambda-cv,1,1,aws-lambda-cv
/cristianpb/cristianpb.github.io,GitHub - cristianpb/cristianpb.github.io: My website,1,1,cristianpb.github.io
/cristianpb/dotfiles,GitHub - cristianpb/dotfiles: My dotfiles,6,6,dotfiles
/cristianpb/dotfiles/blob/master/vim/.vimrc,dotfiles/.vimrc at master 路 cristianpb/dotfiles 路 GitHub,3,2,dotfiles
/cristianpb/dotfiles/tree/master/i3/.config/i3,dotfiles/i3/.config/i3 at master 路 cristianpb/dotfiles 路 GitHub,1,1,dotfiles
/cristianpb/dotfiles/tree/master/R,dotfiles/R at master 路 cristianpb/dotfiles 路 GitHub,1,1,dotfiles
/cristianpb/muse,GitHub - cristianpb/muse: Mopidy web client with Snapcast support,28,16,muse
/cristianpb/muse/search,Search 路 tracks playing 路 GitHub,17,1,muse
/cristianpb/muse/tree/b709e95519d76d15cc76dd7fbe01e92b558a016d/src,muse/src at b709e95519d76d15cc76dd7fbe01e92b558a016d 路 cristianpb/muse 路 GitHub,13,1,muse
/cristianpb/muse/tree/b709e95519d76d15cc76dd7fbe01e92b558a016d,GitHub - cristianpb/muse at b709e95519d76d15cc76dd7fbe01e92b558a016d,10,1,muse
/cristianpb/muse/tree/b709e95519d76d15cc76dd7fbe01e92b558a016d/src/components,muse/src/components at b709e95519d76d15cc76dd7fbe01e92b558a016d 路 cristianpb/...,7,1,muse
/cristianpb/muse/tree/master/src,muse/src at master 路 cristianpb/muse 路 GitHub,5,1,muse
/cristianpb/muse/blob/a0088eb6325f49408bf9898dae03e69f09d601a8/.github/workflows/publish.yml,muse/publish.yml at a0088eb6325f49408bf9898dae03e69f09d601a8 路 cristianpb/mus...,4,1,muse
/cristianpb/muse/blob/b709e95519d76d15cc76dd7fbe01e92b558a016d/src/components/AddToPlaylist.svelte,muse/AddToPlaylist.svelte at b709e95519d76d15cc76dd7fbe01e92b558a016d 路 crist...,4,1,muse
/cristianpb/muse/tree/b709e95519d76d15cc76dd7fbe01e92b558a016d/cypress,muse/cypress at b709e95519d76d15cc76dd7fbe01e92b558a016d 路 cristianpb/muse 路 ...,4,1,muse
/cristianpb/muse/tree/b709e95519d76d15cc76dd7fbe01e92b558a016d/src/routes,muse/src/routes at b709e95519d76d15cc76dd7fbe01e92b558a016d 路 cristianpb/muse...,4,1,muse
/cristianpb/music-s3/actions,Actions 路 cristianpb/music-s3,12,1,music-s3
/cristianpb/music-s3,cristianpb/music-s3,7,2,music-s3
/cristianpb/music-s3/actions/runs/3063988096,debug 路 cristianpb/music-s3@ba09ef4,5,1,music-s3
/cristianpb/music-s3/actions/runs/3056334574, Initial commit 路 cristianpb/music-s3@1a05908,4,1,music-s3
/cristianpb/music-s3/actions/runs/3056404977, Checkoutv1 路 cristianpb/music-s3@216f0dc,3,1,music-s3
/cristianpb/music-s3/actions/runs/3056334574/jobs/4930389193, Initial commit 路 cristianpb/music-s3@1a05908,2,1,music-s3
/cristianpb/music-s3/actions/runs/3056452880, Checkoutv1 路 cristianpb/music-s3@4a9b107,2,1,music-s3
/cristianpb/music-s3/actions/runs/3063988096/jobs/4946660695,debug 路 cristianpb/music-s3@ba09ef4,2,1,music-s3
/cristianpb/music-s3/actions/runs/3063988096/jobs/4946721113,debug 路 cristianpb/music-s3@ba09ef4,2,1,music-s3
/cristianpb/music-s3/actions/runs/3056331858/jobs/4930383411, Initial commit 路 cristianpb/music-s3@d64d703,1,1,music-s3
/cristianpb/object-detection,"GitHub - cristianpb/object-detection: Object detection on Jetson Nano, Raspbe...",27,20,object-detection
/cristianpb/object-detection/blob/master/backend/yolo_detection.py,object-detection/yolo_detection.py at master 路 cristianpb/object-detection 路 ...,11,9,object-detection
/cristianpb/object-detection/blob/master/backend/ssd_detection.py,object-detection/ssd_detection.py at master 路 cristianpb/object-detection 路 G...,9,7,object-detection
/cristianpb/object-detection/blob/master/backend/motion.py,object-detection/motion.py at master 路 cristianpb/object-detection 路 GitHub,2,2,object-detection
/cristianpb/object-detection/tree/master/backend,object-detection/backend at master 路 cristianpb/object-detection 路 GitHub,2,2,object-detection
/cristianpb/object-detection/tree/master/models,object-detection/models at master 路 cristianpb/object-detection 路 GitHub,2,2,object-detection
/cristianpb/object-detection/blob/master/models/ssd_mobilenet/ssd_mobilenet_v2_coco_2018_03_29.pbtxt,object-detection/ssd_mobilenet_v2_coco_2018_03_29.pbtxt at master 路 cristianp...,1,1,object-detection
/cristianpb/object-detection/tree/master/models/ssd_mobilenet,object-detection/models/ssd_mobilenet at master 路 cristianpb/object-detection...,1,1,object-detection
/cristianpb/object-detection/tree/master/models/yolo,object-detection/models/yolo at master 路 cristianpb/object-detection 路 GitHub,1,1,object-detection
/cristianpb/object-detection-frontend,GitHub - cristianpb/object-detection-frontend: Frontend Angular application f...,3,3,object-detection-frontend
/cristianpb/object-detection-frontend/tree/master/src,object-detection-frontend/src at master 路 cristianpb/object-detection-frontend,1,1,object-detection-frontend
/cristianpb/qrcode-reader,cristianpb/qrcode-reader,1,1,qrcode-reader
/cristianpb/rhasspy-handler/issues/4,"""node index.js"" breaks with 'Error: Cannot find module 'onoff'' 路 Issue #4 路 ...",3,3,rhasspy-handler
/cristianpb/rhasspy-handler,GitHub - cristianpb/rhasspy-handler: My voice assistant intent handler,1,1,rhasspy-handler
/cristianpb/rhasspy-handler/blob/master/src/index.ts,rhasspy-handler/index.ts at master 路 cristianpb/rhasspy-handler 路 GitHub,1,1,rhasspy-handler
/cristianpb/rhasspy-handler/tree/master/src,rhasspy-handler/src at master 路 cristianpb/rhasspy-handler 路 GitHub,1,1,rhasspy-handler
/cristianpb/telegraf-influxdb-grafana-docker,"GitHub - cristianpb/telegraf-influxdb-grafana-docker: telegraf, influxdb and ...",16,9,telegraf-influxdb-grafana-docker
/cristianpb/telegraf-influxdb-grafana-docker/blob/master/docker-compose.yml,telegraf-influxdb-grafana-docker/docker-compose.yml at master 路 cristianpb/te...,7,7,telegraf-influxdb-grafana-docker
/cristianpb/telegraf-influxdb-grafana-docker/blob/master/Makefile,telegraf-influxdb-grafana-docker/Makefile at master 路 cristianpb/telegraf-inf...,1,1,telegraf-influxdb-grafana-docker
/cristianpb/telegraf-influxdb-grafana-docker/find/master,File Finder 路 GitHub,1,1,telegraf-influxdb-grafana-docker
/cristianpb/vimwiki,GitHub - cristianpb/vimwiki: My vimwiki,2,1,vimwiki
/cristianpb/vimwiki/tree/master/content,vimwiki/content at master 路 cristianpb/vimwiki 路 GitHub,2,1,vimwiki
/cristianpb/vimwiki/blob/master/content/ESP32.md,vimwiki/ESP32.md at master 路 cristianpb/vimwiki 路 GitHub,1,1,vimwiki
/cristianpb/vimwiki/tree/master/.github/workflows,vimwiki/.github/workflows at master 路 cristianpb/vimwiki 路 GitHub,1,1,vimwiki
/cristianpb/vimwiki/tree/master/layouts,vimwiki/layouts at master 路 cristianpb/vimwiki 路 GitHub,1,1,vimwiki
/cristianpb/vimwiki/tree/master/layouts/_default,vimwiki/layouts/_default at master 路 cristianpb/vimwiki 路 GitHub,1,1,vimwiki
/cristianpb/vimwiki/tree/master/layouts/partials,vimwiki/layouts/partials at master 路 cristianpb/vimwiki 路 GitHub,1,1,vimwiki
/cristianpb/vimwiki/tree/master/layouts/shortcodes,vimwiki/layouts/shortcodes at master 路 cristianpb/vimwiki 路 GitHub,1,1,vimwiki
