path,title,count,uniques,repository
/cristianpb/analytics-google,GitHub - cristianpb/analytics-google: Google analytics from cristianpb.github...,19,5,analytics-google
/cristianpb/analytics-google/tree/master/.github/workflows,analytics-google/.github/workflows at master 路 cristianpb/analytics-google 路 ...,6,2,analytics-google
/cristianpb/analytics-google/blob/master/.github/workflows/data.yml,analytics-google/data.yml at master 路 cristianpb/analytics-google,5,1,analytics-google
/cristianpb/analytics-google/tree/master/src,analytics-google/src at master 路 cristianpb/analytics-google 路 GitHub,4,2,analytics-google
/cristianpb/analytics-google/tree/master/static,analytics-google/static at master 路 cristianpb/analytics-google 路 GitHub,4,2,analytics-google
/cristianpb/analytics-google/blob/master/analytics.py,analytics-google/analytics.py at master 路 cristianpb/analytics-google,2,1,analytics-google
/cristianpb/analytics-google/blob/master/requirements.txt,analytics-google/requirements.txt at master 路 cristianpb/analytics-google,2,1,analytics-google
/cristianpb/analytics-google/blob/master/country.csv,analytics-google/country.csv at master 路 cristianpb/analytics-google,1,1,analytics-google
/cristianpb/analytics-google/blob/master/cypress.json,analytics-google/cypress.json at master 路 cristianpb/analytics-google,1,1,analytics-google
/cristianpb/analytics-google/blob/master/.github/workflows/build.yml,analytics-google/build.yml at master 路 cristianpb/analytics-google,1,1,analytics-google
/cristianpb/aws-lambda-cv,"cristianpb/aws-lambda-cv: Computer Vision, with AWS Lambda",18,1,aws-lambda-cv
/cristianpb/aws-lambda-cv/blob/master/template.yaml,aws-lambda-cv/template.yaml at master 路 cristianpb/aws-lambda-cv,9,1,aws-lambda-cv
/cristianpb/aws-lambda-cv/blob/master/lambda_function.py,aws-lambda-cv/lambda_function.py at master 路 cristianpb/aws-lambda-cv,4,1,aws-lambda-cv
/cristianpb/aws-lambda-cv/tree/master/test,aws-lambda-cv/test at master 路 cristianpb/aws-lambda-cv,2,1,aws-lambda-cv
/cristianpb/cristianpb,GitHub - cristianpb/cristianpb,5,3,cristianpb
/cristianpb/cristianpb/commit/93bc59921ef4fb857d6ced91f08015d20be4e132,Updated content 路 cristianpb/cristianpb@93bc599 路 GitHub,1,1,cristianpb
/cristianpb/cristianpb.github.io/tree/master/_layouts,cristianpb.github.io/_layouts at master 路 cristianpb/cristianpb.github.io 路 G...,6,2,cristianpb.github.io
/cristianpb/cristianpb.github.io,GitHub - cristianpb/cristianpb.github.io: My website,4,2,cristianpb.github.io
/cristianpb/cristianpb.github.io/blob/master/_layouts/post.html,cristianpb.github.io/post.html at master 路 cristianpb/cristianpb.github.io 路 ...,3,2,cristianpb.github.io
/cristianpb/cristianpb.github.io/blob/master/_layouts/default.html,cristianpb.github.io/default.html at master 路 cristianpb/cristianpb.github.io...,2,2,cristianpb.github.io
/cristianpb/cristianpb.github.io/tree/master/_includes,cristianpb.github.io/_includes at master 路 cristianpb/cristianpb.github.io 路 ...,2,2,cristianpb.github.io
/cristianpb/cristianpb.github.io/blob/master/_layouts/iframe.html,cristianpb.github.io/iframe.html at master 路 cristianpb/cristianpb.github.io,1,1,cristianpb.github.io
/cristianpb/cristianpb.github.io/blob/master/_sass/_variables.scss,cristianpb.github.io/_variables.scss at master 路 cristianpb/cristianpb.github...,1,1,cristianpb.github.io
/cristianpb/cristianpb.github.io/tree/master/_sass,cristianpb.github.io/_sass at master 路 cristianpb/cristianpb.github.io,1,1,cristianpb.github.io
/cristianpb/dotfiles,GitHub - cristianpb/dotfiles: My dotfiles,18,9,dotfiles
/cristianpb/dotfiles/tree/master/ranger/.config/ranger,dotfiles/ranger/.config/ranger at master 路 cristianpb/dotfiles 路 GitHub,6,2,dotfiles
/cristianpb/dotfiles/blob/master/ranger/.config/ranger/scope.sh,dotfiles/scope.sh at master 路 cristianpb/dotfiles 路 GitHub,4,3,dotfiles
/cristianpb/dotfiles/tree/master/vim,dotfiles/vim at master 路 cristianpb/dotfiles 路 GitHub,4,3,dotfiles
/cristianpb/dotfiles/blob/master/ranger/.config/ranger/rc.conf,dotfiles/rc.conf at master 路 cristianpb/dotfiles 路 GitHub,4,2,dotfiles
/cristianpb/dotfiles/tree/master/nvim/.config/nvim,dotfiles/nvim/.config/nvim at master 路 cristianpb/dotfiles 路 GitHub,3,2,dotfiles
/cristianpb/dotfiles/blob/master/nvim/.config/nvim/init.vim,dotfiles/init.vim at master 路 cristianpb/dotfiles 路 GitHub,2,2,dotfiles
/cristianpb/dotfiles/blob/master/ranger/.config/ranger/commands_full.py,dotfiles/commands_full.py at master 路 cristianpb/dotfiles 路 GitHub,2,1,dotfiles
/cristianpb/dotfiles/blob/master/ranger/.config/ranger/commands.py,dotfiles/commands.py at master 路 cristianpb/dotfiles 路 GitHub,2,1,dotfiles
/cristianpb/dotfiles/blob/master/ranger/.config/ranger/rifle.conf,dotfiles/rifle.conf at master 路 cristianpb/dotfiles 路 GitHub,2,1,dotfiles
/cristianpb/muse,GitHub - cristianpb/muse: Mopidy web client with Snapcast support,35,15,muse
/cristianpb/muse/issues,Issues 路 cristianpb/muse 路 GitHub,7,5,muse
/cristianpb/muse/issues/20,Add options to play entire folders 路 Issue #20 路 cristianpb/muse 路 GitHub,2,2,muse
/cristianpb/muse/blob/master/MANIFEST.in,muse/MANIFEST.in at master 路 cristianpb/muse 路 GitHub,2,1,muse
/cristianpb/muse/commits/master/MANIFEST.in,History for MANIFEST.in - cristianpb/muse 路 GitHub,2,1,muse
/cristianpb/muse/blob/master/docker-compose.yml,muse/docker-compose.yml at master 路 cristianpb/muse 路 GitHub,1,1,muse
/cristianpb/muse/commit/0b4fbeb48b0286799c14fa57e65f3e6eaf6314b8, Change name to Muse 路 cristianpb/muse@0b4fbeb 路 GitHub,1,1,muse
/cristianpb/muse/issues/37,Option to search for artists 路 Issue #37 路 cristianpb/muse 路 GitHub,1,1,muse
/cristianpb/muse/issues/39,Add snapcast stream support 路 Issue #39 路 cristianpb/muse 路 GitHub,1,1,muse
/cristianpb/muse/issues/42,Searching all backends returns no result 路 Issue #42 路 cristianpb/muse 路 GitHub,1,1,muse
/cristianpb/myhubot,cristianpb/myhubot: Open source bot written in CoffeeScript on Node.js,2,1,myhubot
/cristianpb/newsapp,cristianpb/newsapp,1,1,newsapp
/cristianpb/object-detection,"GitHub - cristianpb/object-detection: Object detection on Jetson Nano, Raspbe...",51,34,object-detection
/cristianpb/object-detection/blob/master/backend/yolo_detection.py,object-detection/yolo_detection.py at master 路 cristianpb/object-detection 路 ...,23,16,object-detection
/cristianpb/object-detection/blob/master/backend/ssd_detection.py,object-detection/ssd_detection.py at master 路 cristianpb/object-detection 路 G...,11,9,object-detection
/cristianpb/object-detection/tree/master/backend,object-detection/backend at master 路 cristianpb/object-detection 路 GitHub,11,8,object-detection
/cristianpb/object-detection/tree/master/models,object-detection/models at master 路 cristianpb/object-detection 路 GitHub,7,6,object-detection
/cristianpb/object-detection/tree/master/tests,object-detection/tests at master 路 cristianpb/object-detection 路 GitHub,4,3,object-detection
/cristianpb/object-detection/blob/master/setup.py,object-detection/setup.py at master 路 cristianpb/object-detection 路 GitHub,3,3,object-detection
/cristianpb/object-detection/tree/master/models/ssd_mobilenet,object-detection/models/ssd_mobilenet at master 路 cristianpb/object-detection...,3,3,object-detection
/cristianpb/object-detection/tree/master/models/yolo,object-detection/models/yolo at master 路 cristianpb/object-detection 路 GitHub,3,3,object-detection
/cristianpb/object-detection/tree/master/nginx,object-detection/nginx at master 路 cristianpb/object-detection 路 GitHub,3,3,object-detection
/cristianpb/object-detection-frontend,GitHub - cristianpb/object-detection-frontend: Frontend Angular application f...,5,4,object-detection-frontend
/cristianpb/rhasspy-handler,GitHub - cristianpb/rhasspy-handler: My voice assistant intent handler,8,3,rhasspy-handler
/cristianpb/rhasspy-handler/issues/4,"""node index.js"" breaks with 'Error: Cannot find module 'onoff'' 路 Issue #4 路 ...",6,6,rhasspy-handler
/cristianpb/rhasspy-handler/tree/master/src,rhasspy-handler/src at master 路 cristianpb/rhasspy-handler 路 GitHub,4,1,rhasspy-handler
/cristianpb/rhasspy-handler/blob/master/Makefile,rhasspy-handler/Makefile at master 路 cristianpb/rhasspy-handler 路 GitHub,1,1,rhasspy-handler
/cristianpb/telegraf-influxdb-grafana-docker,"GitHub - cristianpb/telegraf-influxdb-grafana-docker: telegraf, influxdb and ...",13,6,telegraf-influxdb-grafana-docker
/cristianpb/telegraf-influxdb-grafana-docker/blob/master/docker-compose.yml,telegraf-influxdb-grafana-docker/docker-compose.yml at master 路 cristianpb/te...,6,4,telegraf-influxdb-grafana-docker
/cristianpb/telegraf-influxdb-grafana-docker/blob/master/.env_dist,telegraf-influxdb-grafana-docker/.env_dist at master 路 cristianpb/telegraf-in...,2,2,telegraf-influxdb-grafana-docker
/cristianpb/telegraf-influxdb-grafana-docker/tree/master/docker,telegraf-influxdb-grafana-docker/docker at master 路 cristianpb/telegraf-influ...,2,2,telegraf-influxdb-grafana-docker
/cristianpb/telegraf-influxdb-grafana-docker/blob/master/Makefile,telegraf-influxdb-grafana-docker/Makefile at master 路 cristianpb/telegraf-inf...,2,1,telegraf-influxdb-grafana-docker
/cristianpb/telegraf-influxdb-grafana-docker/tree/master/docker/influxdb,telegraf-influxdb-grafana-docker/docker/influxdb at master 路 cristianpb/teleg...,2,1,telegraf-influxdb-grafana-docker
/cristianpb/telegraf-influxdb-grafana-docker/blob/master/docker-compose-gpu.yml,telegraf-influxdb-grafana-docker/docker-compose-gpu.yml at master 路 cristianp...,1,1,telegraf-influxdb-grafana-docker
/cristianpb/telegraf-influxdb-grafana-docker/blob/master/docker/influxdb/influxdb.conf,telegraf-influxdb-grafana-docker/influxdb.conf at master 路 cristianpb/telegra...,1,1,telegraf-influxdb-grafana-docker
/cristianpb/telegraf-influxdb-grafana-docker/blob/master/docker/influxdb/types.db,telegraf-influxdb-grafana-docker/types.db at master 路 cristianpb/telegraf-inf...,1,1,telegraf-influxdb-grafana-docker
/cristianpb/telegraf-influxdb-grafana-docker/blob/master/docker/telegraf/telegraf-gpu.conf,telegraf-influxdb-grafana-docker/telegraf-gpu.conf at master 路 cristianpb/tel...,1,1,telegraf-influxdb-grafana-docker
/cristianpb/vimwiki,GitHub - cristianpb/vimwiki: My vimwiki,32,6,vimwiki
/cristianpb/vimwiki/tree/master/layouts,vimwiki/layouts at master 路 cristianpb/vimwiki,13,2,vimwiki
/cristianpb/vimwiki/tree/master/content,vimwiki/content at master 路 cristianpb/vimwiki 路 GitHub,9,4,vimwiki
/cristianpb/vimwiki/tree/master/.github/workflows,vimwiki/.github/workflows at master 路 cristianpb/vimwiki,7,2,vimwiki
/cristianpb/vimwiki/blob/master/config.toml,vimwiki/config.toml at master 路 cristianpb/vimwiki,5,4,vimwiki
/cristianpb/vimwiki/blob/master/.gitignore,vimwiki/.gitignore at master 路 cristianpb/vimwiki,5,1,vimwiki
/cristianpb/vimwiki/tree/master/assets/css,vimwiki/assets/css at master 路 cristianpb/vimwiki,4,3,vimwiki
/cristianpb/vimwiki/blob/master/README.md,vimwiki/README.md at master 路 cristianpb/vimwiki,4,2,vimwiki
/cristianpb/vimwiki/tree/master/layouts/shortcodes,vimwiki/layouts/shortcodes at master 路 cristianpb/vimwiki,4,2,vimwiki
/cristianpb/vimwiki/blob/master/config-gh.toml,vimwiki/config-gh.toml at master 路 cristianpb/vimwiki,3,1,vimwiki
