path,title,count,uniques,repository
/cristianpb/analytics-google,GitHub - cristianpb/analytics-google: Google analytics from cristianpb.github...,8,7,analytics-google
/cristianpb/cristianpb.github.io,cristianpb/cristianpb.github.io: My website,22,2,cristianpb.github.io
/cristianpb/cristianpb.github.io/actions,Actions 路 cristianpb/cristianpb.github.io,10,1,cristianpb.github.io
/cristianpb/cristianpb.github.io/tree/master/.github/workflows,cristianpb.github.io/.github/workflows at master 路 cristianpb/cristianpb.gith...,9,1,cristianpb.github.io
/cristianpb/cristianpb.github.io/blob/master/.github/workflows/tests.yml,cristianpb.github.io/tests.yml at master 路 cristianpb/cristianpb.github.io,8,1,cristianpb.github.io
/cristianpb/cristianpb.github.io/actions/runs/1279906915,Bump nokogiri from 1.10.9 to 1.12.5 路 cristianpb/cristianpb.github.io@672405c,5,1,cristianpb.github.io
/cristianpb/cristianpb.github.io/actions/workflows/tests.yml,Actions 路 cristianpb/cristianpb.github.io,5,1,cristianpb.github.io
/cristianpb/cristianpb.github.io/actions/runs/1117789384,Bump path-parse from 1.0.6 to 1.0.7 路 cristianpb/cristianpb.github.io@d033796,3,1,cristianpb.github.io
/cristianpb/cristianpb.github.io/runs/3725199417,Bump nokogiri from 1.10.9 to 1.12.5 路 cristianpb/cristianpb.github.io@672405c,2,1,cristianpb.github.io
/cristianpb/cristianpb.github.io/tree/master/assets,cristianpb.github.io/assets at master 路 cristianpb/cristianpb.github.io,2,1,cristianpb.github.io
/cristianpb/cristianpb.github.io/tree/master/assets/img,cristianpb.github.io/assets/img at master 路 cristianpb/cristianpb.github.io,2,1,cristianpb.github.io
/cristianpb/dotfiles,GitHub - cristianpb/dotfiles: My dotfiles,25,9,dotfiles
/cristianpb/dotfiles/tree/master/ranger/.config/ranger,dotfiles/ranger/.config/ranger at master 路 cristianpb/dotfiles 路 GitHub,12,4,dotfiles
/cristianpb/dotfiles/search,Search 路 HUGO_baseURL 路 GitHub,12,1,dotfiles
/cristianpb/dotfiles/blob/master/ranger/.config/ranger/rc.conf,dotfiles/rc.conf at master 路 cristianpb/dotfiles,5,2,dotfiles
/cristianpb/dotfiles/blob/master/ranger/.config/ranger/scope.sh,dotfiles/scope.sh at master 路 cristianpb/dotfiles,5,2,dotfiles
/cristianpb/dotfiles/blob/master/vim/.vimrc,dotfiles/.vimrc at master 路 cristianpb/dotfiles 路 GitHub,5,2,dotfiles
/cristianpb/dotfiles/tree/master/vim,dotfiles/vim at master 路 cristianpb/dotfiles 路 GitHub,5,2,dotfiles
/cristianpb/dotfiles/blob/master/wiki2html.sh,dotfiles/wiki2html.sh at master 路 cristianpb/dotfiles 路 GitHub,4,3,dotfiles
/cristianpb/dotfiles/blob/master/ranger/.config/ranger/rifle.conf,dotfiles/rifle.conf at master 路 cristianpb/dotfiles,4,2,dotfiles
/cristianpb/dotfiles/blob/master/ranger/.config/ranger/commands.py,dotfiles/commands.py at master 路 cristianpb/dotfiles,3,2,dotfiles
/cristianpb/muse,GitHub - cristianpb/muse: Mopidy web client with Snapcast support,24,14,muse
/cristianpb/muse/issues,Issues 路 cristianpb/muse 路 GitHub,13,4,muse
/cristianpb/muse/actions/runs/121509959/workflow, Bump version automatically in package-lock.json 路 cristianpb/muse@80c3cb5,3,3,muse
/cristianpb/muse/issues/15,Snapcast server settings are not stored 路 Issue #15 路 cristianpb/muse,2,2,muse
/cristianpb/muse/issues/39,Add snapcast stream support 路 Issue #39 路 cristianpb/muse 路 GitHub,2,2,muse
/cristianpb/muse/blob/master/MANIFEST.in,muse/MANIFEST.in at master 路 cristianpb/muse 路 GitHub,1,1,muse
/cristianpb/muse/blob/master/mopidy_muse/ext.conf,muse/ext.conf at master 路 cristianpb/muse,1,1,muse
/cristianpb/muse/blob/master/mopidy_muse/mopidy.conf,muse/mopidy.conf at master 路 cristianpb/muse,1,1,muse
/cristianpb/muse/blob/master/src/server.js,muse/server.js at master 路 cristianpb/muse,1,1,muse
/cristianpb/muse/issues/37,Option to search for artists 路 Issue #37 路 cristianpb/muse 路 GitHub,1,1,muse
/cristianpb/newsapp,GitHub - cristianpb/newsapp,1,1,newsapp
/cristianpb/object-detection,"GitHub - cristianpb/object-detection: Object detection on Jetson Nano, Raspbe...",65,24,object-detection
/cristianpb/object-detection/tree/master/backend,object-detection/backend at master 路 cristianpb/object-detection 路 GitHub,23,10,object-detection
/cristianpb/object-detection/blob/master/backend/ssd_detection.py,object-detection/ssd_detection.py at master 路 cristianpb/object-detection 路 G...,22,9,object-detection
/cristianpb/object-detection/blob/master/backend/yolo_detection.py,object-detection/yolo_detection.py at master 路 cristianpb/object-detection 路 ...,15,11,object-detection
/cristianpb/object-detection/tree/master/models,object-detection/models at master 路 cristianpb/object-detection 路 GitHub,10,5,object-detection
/cristianpb/object-detection/tree/master/models/ssd_mobilenet,object-detection/models/ssd_mobilenet at master 路 cristianpb/object-detection...,6,4,object-detection
/cristianpb/object-detection/tree/master/nginx,object-detection/nginx at master 路 cristianpb/object-detection 路 GitHub,6,1,object-detection
/cristianpb/object-detection/blob/master/backend/motion.py,object-detection/motion.py at master 路 cristianpb/object-detection 路 GitHub,4,4,object-detection
/cristianpb/object-detection/issues,Issues 路 cristianpb/object-detection 路 GitHub,3,2,object-detection
/cristianpb/object-detection/search,Search 路 img_to_base64 路 GitHub,3,1,object-detection
/cristianpb/object-detection-frontend,GitHub - cristianpb/object-detection-frontend: Frontend Angular application f...,1,1,object-detection-frontend
/cristianpb/rhasspy-handler/issues/4,"""node index.js"" breaks with 'Error: Cannot find module 'onoff'' 路 Issue #4 路 ...",10,8,rhasspy-handler
/cristianpb/rhasspy-handler/tree/master/rhasspy/.config/rhasspy/profiles/es,rhasspy-handler/rhasspy/.config/rhasspy/profiles/es at master 路 cristianpb/rh...,2,2,rhasspy-handler
/cristianpb/rhasspy-handler,cristianpb/rhasspy-handler: My voice assistant intent handler,1,1,rhasspy-handler
/cristianpb/rhasspy-handler/blob/master/Makefile,rhasspy-handler/Makefile at master 路 cristianpb/rhasspy-handler,1,1,rhasspy-handler
/cristianpb/rhasspy-handler/blob/master/rhasspy/.config/rhasspy/profiles/es/kaldi_custom_words.txt,rhasspy-handler/kaldi_custom_words.txt at master 路 cristianpb/rhasspy-handler...,1,1,rhasspy-handler
/cristianpb/rhasspy-handler/blob/master/rhasspy/.config/rhasspy/profiles/es/sentences.ini,rhasspy-handler/sentences.ini at master 路 cristianpb/rhasspy-handler 路 GitHub,1,1,rhasspy-handler
/cristianpb/rhasspy-handler/blob/master/rhasspy/.config/rhasspy/profiles/es/slots/service,rhasspy-handler/service at master 路 cristianpb/rhasspy-handler 路 GitHub,1,1,rhasspy-handler
/cristianpb/rhasspy-handler/tree/master/rhasspy/.config/rhasspy/profiles/es/slots,rhasspy-handler/rhasspy/.config/rhasspy/profiles/es/slots at master 路 cristia...,1,1,rhasspy-handler
/cristianpb/rhasspy-handler/tree/master/src,rhasspy-handler/src at master 路 cristianpb/rhasspy-handler,1,1,rhasspy-handler
/cristianpb/telegraf-influxdb-grafana-docker,"GitHub - cristianpb/telegraf-influxdb-grafana-docker: telegraf, influxdb and ...",54,18,telegraf-influxdb-grafana-docker
/cristianpb/telegraf-influxdb-grafana-docker/blob/master/docker-compose.yml,telegraf-influxdb-grafana-docker/docker-compose.yml at master 路 cristianpb/te...,33,11,telegraf-influxdb-grafana-docker
/cristianpb/telegraf-influxdb-grafana-docker/tree/master/docker,telegraf-influxdb-grafana-docker/docker at master 路 cristianpb/telegraf-influ...,22,10,telegraf-influxdb-grafana-docker
/cristianpb/telegraf-influxdb-grafana-docker/blob/master/docker-compose-gpu.yml,telegraf-influxdb-grafana-docker/docker-compose-gpu.yml at master 路 cristianp...,16,5,telegraf-influxdb-grafana-docker
/cristianpb/telegraf-influxdb-grafana-docker/tree/master/docker/grafana,telegraf-influxdb-grafana-docker/docker/grafana at master 路 cristianpb/telegr...,10,5,telegraf-influxdb-grafana-docker
/cristianpb/telegraf-influxdb-grafana-docker/tree/master/docker/telegraf,telegraf-influxdb-grafana-docker/docker/telegraf at master 路 cristianpb/teleg...,9,4,telegraf-influxdb-grafana-docker
/cristianpb/telegraf-influxdb-grafana-docker/blob/master/.env_dist,telegraf-influxdb-grafana-docker/.env_dist at master 路 cristianpb/telegraf-in...,6,4,telegraf-influxdb-grafana-docker
/cristianpb/telegraf-influxdb-grafana-docker/blob/master/docker/grafana/DashboardTelegraf.json,telegraf-influxdb-grafana-docker/DashboardTelegraf.json at master 路 cristianp...,6,3,telegraf-influxdb-grafana-docker
/cristianpb/telegraf-influxdb-grafana-docker/blob/master/docker/telegraf/telegraf.conf,telegraf-influxdb-grafana-docker/telegraf.conf at master 路 cristianpb/telegra...,6,3,telegraf-influxdb-grafana-docker
/cristianpb/telegraf-influxdb-grafana-docker/tree/master/docker/influxdb,telegraf-influxdb-grafana-docker/docker/influxdb at master 路 cristianpb/teleg...,6,2,telegraf-influxdb-grafana-docker
/cristianpb/vimwiki,GitHub - cristianpb/vimwiki: My vimwiki,10,3,vimwiki
/cristianpb/vimwiki/blob/master/config.toml,vimwiki/config.toml at master 路 cristianpb/vimwiki 路 GitHub,6,2,vimwiki
/cristianpb/vimwiki/tree/master/content,vimwiki/content at master 路 cristianpb/vimwiki 路 GitHub,3,2,vimwiki
/cristianpb/vimwiki/blob/master/config-gh.toml,vimwiki/config-gh.toml at master 路 cristianpb/vimwiki 路 GitHub,2,1,vimwiki
/cristianpb/vimwiki/blob/master/assets/css/dark.css,vimwiki/dark.css at master 路 cristianpb/vimwiki 路 GitHub,1,1,vimwiki
/cristianpb/vimwiki/blob/master/content/amp.md,vimwiki/amp.md at master 路 cristianpb/vimwiki 路 GitHub,1,1,vimwiki
/cristianpb/vimwiki/blob/master/content/ESP32.md,vimwiki/ESP32.md at master 路 cristianpb/vimwiki 路 GitHub,1,1,vimwiki
/cristianpb/vimwiki/blob/master/content/JetsonNano.md,vimwiki/JetsonNano.md at master 路 cristianpb/vimwiki 路 GitHub,1,1,vimwiki
/cristianpb/vimwiki/blob/master/README.md,vimwiki/README.md at master 路 cristianpb/vimwiki 路 GitHub,1,1,vimwiki
/cristianpb/vimwiki/commit/c0f62cb76dd4555d6654fe6b50b5a772a0532bee, Use Hugo isntead of Jekyll 路 cristianpb/vimwiki@c0f62cb 路 GitHub,1,1,vimwiki
