path,title,count,uniques,repository
/cristianpb/analytics-google,cristianpb/analytics-google: Google analytics from cristianpb.github.io,2,2,analytics-google
/cristianpb/cristianpb.github.io/blob/0344ef3738b8d134ca7902b080a36c76fbe38ea9/jekyll_collections/_posts/2019-07-11-grafana-dashboard.md,cristianpb.github.io/2019-07-11-grafana-dashboard.md at 0344ef3738b8d134ca790...,1,1,cristianpb.github.io
/cristianpb/deces-dataprep,GitHub - cristianpb/deces-dataprep: matchID dataprep for fichier-des-personne...,2,1,deces-dataprep
/cristianpb/deces-dataprep/actions,Actions 路 cristianpb/deces-dataprep 路 GitHub,2,1,deces-dataprep
/cristianpb/deces-dataprep/actions/runs/307210725,try to add entropy 路 cristianpb/deces-dataprep@2efb64e 路 GitHub,1,1,deces-dataprep
/cristianpb/deces-dataprep/tree/feat/test-ci-ga,GitHub - cristianpb/deces-dataprep at feat/test-ci-ga,1,1,deces-dataprep
/cristianpb/deces-dataprep/tree/test/add-github-actions-ci,GitHub - cristianpb/deces-dataprep at test/add-github-actions-ci,1,1,deces-dataprep
/cristianpb/dotfiles,GitHub - cristianpb/dotfiles: My dotfiles,38,8,dotfiles
/cristianpb/dotfiles/tree/master/ranger/.config/ranger,dotfiles/ranger/.config/ranger at master 路 cristianpb/dotfiles 路 GitHub,17,5,dotfiles
/cristianpb/dotfiles/tree/master/i3/.config/i3,dotfiles/i3/.config/i3 at master 路 cristianpb/dotfiles 路 GitHub,13,1,dotfiles
/cristianpb/dotfiles/blob/master/ranger/.config/ranger/commands.py,dotfiles/commands.py at master 路 cristianpb/dotfiles 路 GitHub,11,4,dotfiles
/cristianpb/dotfiles/tree/master/vim,dotfiles/vim at master 路 cristianpb/dotfiles 路 GitHub,7,2,dotfiles
/cristianpb/dotfiles/blob/master/vim/.vimrc,dotfiles/.vimrc at master 路 cristianpb/dotfiles 路 GitHub,7,1,dotfiles
/cristianpb/dotfiles/tree/master/nvim/.config/nvim,dotfiles/nvim/.config/nvim at master 路 cristianpb/dotfiles 路 GitHub,6,1,dotfiles
/cristianpb/dotfiles/blob/master/ranger/.config/ranger/rc.conf,dotfiles/rc.conf at master 路 cristianpb/dotfiles 路 GitHub,5,4,dotfiles
/cristianpb/dotfiles/blob/master/i3/.config/i3/config,dotfiles/config at master 路 cristianpb/dotfiles 路 GitHub,5,1,dotfiles
/cristianpb/dotfiles/tree/master/i3,dotfiles/i3 at master 路 cristianpb/dotfiles 路 GitHub,5,1,dotfiles
/cristianpb/muse,GitHub - cristianpb/muse: Mopidy web client with Snapcast support,39,15,muse
/cristianpb/muse/issues,Issues 路 cristianpb/muse 路 GitHub,17,3,muse
/cristianpb/muse/issues/14,FR: Dark theme 路 Issue #14 路 cristianpb/muse 路 GitHub,7,1,muse
/cristianpb/muse/tree/master/mopidy_muse,muse/mopidy_muse at master 路 cristianpb/muse 路 GitHub,3,2,muse
/cristianpb/muse/blob/master/MANIFEST.in,muse/MANIFEST.in at master 路 cristianpb/muse 路 GitHub,2,2,muse
/cristianpb/muse/issues/25,Support for older browsers (Mobile safari & chrome) 路 Issue #25 路 cristianpb/...,2,2,muse
/cristianpb/muse/actions,Actions 路 cristianpb/muse 路 GitHub,2,1,muse
/cristianpb/muse/blob/master/setup.cfg,muse/setup.cfg at master 路 cristianpb/muse 路 GitHub,2,1,muse
/cristianpb/muse/commits/master,Commits 路 cristianpb/muse 路 GitHub,2,1,muse
/cristianpb/muse/actions/runs/121509959/workflow, Bump version automatically in package-lock.json 路 cristianpb/muse@80c3cb5 ...,1,1,muse
/cristianpb/object-detection,"GitHub - cristianpb/object-detection: Object detection on Jetson Nano, Raspbe...",94,66,object-detection
/cristianpb/object-detection/tree/master/backend,object-detection/backend at master 路 cristianpb/object-detection 路 GitHub,29,18,object-detection
/cristianpb/object-detection/blob/master/backend/yolo_detection.py,object-detection/yolo_detection.py at master 路 cristianpb/object-detection 路 ...,18,12,object-detection
/cristianpb/object-detection/blob/master/backend/ssd_detection.py,object-detection/ssd_detection.py at master 路 cristianpb/object-detection 路 G...,16,12,object-detection
/cristianpb/object-detection/tree/master/models,object-detection/models at master 路 cristianpb/object-detection 路 GitHub,8,5,object-detection
/cristianpb/object-detection/blob/master/backend/camera.py,object-detection/camera.py at master 路 cristianpb/object-detection 路 GitHub,6,5,object-detection
/cristianpb/object-detection/blob/master/backend/centroidtracker.py,object-detection/centroidtracker.py at master 路 cristianpb/object-detection 路...,6,5,object-detection
/cristianpb/object-detection/blob/master/tests/test_detection.py,object-detection/test_detection.py at master 路 cristianpb/object-detection 路 ...,6,4,object-detection
/cristianpb/object-detection/tree/master/tests,object-detection/tests at master 路 cristianpb/object-detection 路 GitHub,6,4,object-detection
/cristianpb/object-detection/blob/master/README.md,object-detection/README.md at master 路 cristianpb/object-detection 路 GitHub,6,3,object-detection
/cristianpb/object-detection-frontend,GitHub - cristianpb/object-detection-frontend: Frontend Angular application f...,14,11,object-detection-frontend
/cristianpb/object-detection-frontend/tree/master/src,object-detection-frontend/src at master 路 cristianpb/object-detection-fronten...,2,1,object-detection-frontend
/cristianpb/object-detection-frontend/blob/master/angular.json,object-detection-frontend/angular.json at master 路 cristianpb/object-detectio...,1,1,object-detection-frontend
/cristianpb/object-detection-frontend/blob/master/README.md,object-detection-frontend/README.md at master 路 cristianpb/object-detection-f...,1,1,object-detection-frontend
/cristianpb/object-detection-frontend/tree/master/src/app,object-detection-frontend/src/app at master 路 cristianpb/object-detection-fro...,1,1,object-detection-frontend
/cristianpb/object-detection-frontend/tree/master/src/app/camera,object-detection-frontend/src/app/camera at master 路 cristianpb/object-detect...,1,1,object-detection-frontend
/cristianpb/rhasspy-handler/issues/4,"""node index.js"" breaks with 'Error: Cannot find module 'onoff'' 路 Issue #4 路 ...",8,6,rhasspy-handler
/cristianpb/rhasspy-handler,GitHub - cristianpb/rhasspy-handler: My voice assistant intent handler,3,2,rhasspy-handler
/cristianpb/rhasspy-handler/tree/master/src,rhasspy-handler/src at master 路 cristianpb/rhasspy-handler 路 GitHub,2,1,rhasspy-handler
/cristianpb/rhasspy-handler/blob/master/src/lights.ts,rhasspy-handler/lights.ts at master 路 cristianpb/rhasspy-handler 路 GitHub,1,1,rhasspy-handler
/cristianpb/rhasspy-handler/tree/master/rhasspy/.config/rhasspy/profiles/es,rhasspy-handler/rhasspy/.config/rhasspy/profiles/es at master 路 cristianpb/rh...,1,1,rhasspy-handler
/cristianpb/simple-streaming-gateway,cristianpb/simple-streaming-gateway: Flask App to stream generated sensor dat...,2,1,simple-streaming-gateway
/cristianpb/telegraf-influxdb-grafana-docker,"GitHub - cristianpb/telegraf-influxdb-grafana-docker: telegraf, influxdb and ...",12,9,telegraf-influxdb-grafana-docker
/cristianpb/telegraf-influxdb-grafana-docker/blob/master/docker-compose.yml,telegraf-influxdb-grafana-docker/docker-compose.yml at master 路 cristianpb/te...,10,4,telegraf-influxdb-grafana-docker
/cristianpb/telegraf-influxdb-grafana-docker/tree/master/docker,telegraf-influxdb-grafana-docker/docker at master 路 cristianpb/telegraf-influ...,6,3,telegraf-influxdb-grafana-docker
/cristianpb/telegraf-influxdb-grafana-docker/tree/master/docker/telegraf,telegraf-influxdb-grafana-docker/docker/telegraf at master 路 cristianpb/teleg...,4,3,telegraf-influxdb-grafana-docker
/cristianpb/telegraf-influxdb-grafana-docker/blob/master/Makefile,telegraf-influxdb-grafana-docker/Makefile at master 路 cristianpb/telegraf-inf...,4,2,telegraf-influxdb-grafana-docker
/cristianpb/telegraf-influxdb-grafana-docker/blob/master/docker/telegraf/telegraf.conf,telegraf-influxdb-grafana-docker/telegraf.conf at master 路 cristianpb/telegra...,2,2,telegraf-influxdb-grafana-docker
/cristianpb/telegraf-influxdb-grafana-docker/blob/master/.env_dist,telegraf-influxdb-grafana-docker/.env_dist at master 路 cristianpb/telegraf-in...,2,2,telegraf-influxdb-grafana-docker
/cristianpb/telegraf-influxdb-grafana-docker/tree/master/docker/grafana,telegraf-influxdb-grafana-docker/docker/grafana at master 路 cristianpb/telegr...,2,2,telegraf-influxdb-grafana-docker
/cristianpb/telegraf-influxdb-grafana-docker/tree/master/docker/influxdb,telegraf-influxdb-grafana-docker/docker/influxdb at master 路 cristianpb/teleg...,2,2,telegraf-influxdb-grafana-docker
/cristianpb/telegraf-influxdb-grafana-docker/blob/master/docker-compose-gpu.yml,telegraf-influxdb-grafana-docker/docker-compose-gpu.yml at master 路 cristianp...,2,1,telegraf-influxdb-grafana-docker
/cristianpb/vimwiki,GitHub - cristianpb/vimwiki: My vimwiki,11,5,vimwiki
/cristianpb/vimwiki/tree/master/content,vimwiki/content at master 路 cristianpb/vimwiki 路 GitHub,6,2,vimwiki
/cristianpb/vimwiki/blob/master/config.toml,vimwiki/config.toml at master 路 cristianpb/vimwiki 路 GitHub,2,2,vimwiki
/cristianpb/vimwiki/blob/master/content/ESP8266.md,vimwiki/ESP8266.md at master 路 cristianpb/vimwiki,2,1,vimwiki
/cristianpb/vimwiki/blob/master/content/index.md,vimwiki/index.md at master 路 cristianpb/vimwiki,2,1,vimwiki
/cristianpb/vimwiki/blob/master/content/vimmd.md,vimwiki/vimmd.md at master 路 cristianpb/vimwiki,2,1,vimwiki
/cristianpb/vimwiki/blob/master/config-gh.toml,vimwiki/config-gh.toml at master 路 cristianpb/vimwiki 路 GitHub,1,1,vimwiki
/cristianpb/vimwiki/blob/master/content/arch_linux.md,vimwiki/arch_linux.md at master 路 cristianpb/vimwiki 路 GitHub,1,1,vimwiki
/cristianpb/vimwiki/blob/master/content/keyboard.md,vimwiki/keyboard.md at master 路 cristianpb/vimwiki 路 GitHub,1,1,vimwiki
/cristianpb/vimwiki/blob/master/content/remote.it,vimwiki/remote.it at master 路 cristianpb/vimwiki 路 GitHub,1,1,vimwiki
