path,title,count,uniques,repository
/cristianpb/analytics-google,cristianpb/analytics-google: Google analytics from cristianpb.github.io,2,2,analytics-google
/cristianpb/analytics-google/blob/master/README.md,analytics-google/README.md at master 路 cristianpb/analytics-google,2,1,analytics-google
/cristianpb/analytics-google/blob/master/src/app.html,analytics-google/src/app.html at master 路 cristianpb/analytics-google,2,1,analytics-google
/cristianpb/analytics-google/blob/master/src/app.postcss,analytics-google/src/app.postcss at master 路 cristianpb/analytics-google,2,1,analytics-google
/cristianpb/analytics-google/blob/master/src/lib/index.js,analytics-google/src/lib/index.js at master 路 cristianpb/analytics-google,2,1,analytics-google
/cristianpb/analytics-google/blob/master/src/lib/views/Charts.svelte,analytics-google/src/lib/views/Charts.svelte at master 路 cristianpb/analytics...,2,1,analytics-google
/cristianpb/analytics-google/blob/master/src/lib/views/Table.svelte,analytics-google/src/lib/views/Table.svelte at master 路 cristianpb/analytics-...,2,1,analytics-google
/cristianpb/analytics-google/blob/master/src/routes/%2Bpage.js,analytics-google/src/routes/+page.js at master 路 cristianpb/analytics-google,2,1,analytics-google
/cristianpb/analytics-google/blob/master/src/routes/%2Bpage.svelte,analytics-google/src/routes/+page.svelte at master 路 cristianpb/analytics-goo...,2,1,analytics-google
/cristianpb/analytics-google/blob/master/src/routes/Nav.svelte,analytics-google/src/routes/Nav.svelte at master 路 cristianpb/analytics-google,2,1,analytics-google
/cristianpb/dotfiles/tree/master/ranger/.config/ranger,dotfiles/ranger/.config/ranger at master 路 cristianpb/dotfiles 路 GitHub,8,3,dotfiles
/cristianpb/dotfiles/tree/master,GitHub - cristianpb/dotfiles: My dotfiles,7,4,dotfiles
/cristianpb/dotfiles/blob/master/vim/.vimrc,dotfiles/vim/.vimrc at master 路 cristianpb/dotfiles,4,1,dotfiles
/cristianpb/dotfiles/tree/master/polybar/.config/polybar,dotfiles/polybar/.config/polybar at master 路 cristianpb/dotfiles,3,1,dotfiles
/cristianpb/dotfiles/blob/master/ranger/.config/ranger/rc.conf,dotfiles/ranger/.config/ranger/rc.conf at master 路 cristianpb/dotfiles 路 GitHub,2,1,dotfiles
/cristianpb/dotfiles/blob/master/wiki2html.sh,dotfiles/wiki2html.sh at master 路 cristianpb/dotfiles,2,1,dotfiles
/cristianpb/dotfiles/tree/master/polybar/.config/polybar/scripts,dotfiles/polybar/.config/polybar/scripts at master 路 cristianpb/dotfiles,2,1,dotfiles
/cristianpb/dotfiles/tree/master/ranger,dotfiles/ranger at master 路 cristianpb/dotfiles,2,1,dotfiles
/cristianpb/dotfiles/tree/master/ranger/.config,dotfiles/ranger/.config at master 路 cristianpb/dotfiles,2,1,dotfiles
/cristianpb/dotfiles,cristianpb/dotfiles: My dotfiles,1,1,dotfiles
/cristianpb/muse,GitHub - cristianpb/muse: Mopidy web client with Snapcast support,21,16,muse
/cristianpb/muse/blob/master/docker-compose.yml,muse/docker-compose.yml at master 路 cristianpb/muse 路 GitHub,11,3,muse
/cristianpb/muse/blob/master/Dockerfile-base,muse/Dockerfile-base at master 路 cristianpb/muse,6,1,muse
/cristianpb/muse/blob/master/Dockerfile,muse/Dockerfile at master 路 cristianpb/muse,4,1,muse
/cristianpb/muse/commits/master,Commits 路 cristianpb/muse,4,1,muse
/cristianpb/muse/blob/master/Dockerfile-snapserver,muse/Dockerfile-snapserver at master 路 cristianpb/muse,2,1,muse
/cristianpb/muse/blob/master/setup.cfg,muse/setup.cfg at master 路 cristianpb/muse,2,1,muse
/cristianpb/muse/commit/060e4372975b70bd39e31dd4f9356e31f5e1dfdd, Use own snapserver docker image 路 cristianpb/muse@060e437,1,1,muse
/cristianpb/muse/commit/9098b3754e7c5e1f9b98a4858a1490a5ab1e113b, Publish docker tags 路 cristianpb/muse@9098b37,1,1,muse
/cristianpb/muse/issues,Issues 路 cristianpb/muse,1,1,muse
/cristianpb/music-s3/actions/runs/7416041325,Workflow 路 cristianpb/music-s3@e7873f0 路 GitHub,3,3,music-s3
/cristianpb/music-s3/actions/runs/7416041325/job/20180276933,Workflow 路 cristianpb/music-s3@e7873f0 路 GitHub,1,1,music-s3
/cristianpb/object-detection,"GitHub - cristianpb/object-detection: Object detection on Jetson Nano, Raspbe...",11,10,object-detection
/cristianpb/object-detection/blob/master/backend/ssd_detection.py,object-detection/backend/ssd_detection.py at master 路 cristianpb/object-detec...,6,3,object-detection
/cristianpb/object-detection/blob/master/models/ssd_mobilenet/labels.json,object-detection/models/ssd_mobilenet/labels.json at master 路 cristianpb/obje...,4,1,object-detection
/cristianpb/object-detection/tree/master/backend,object-detection/backend at master 路 cristianpb/object-detection 路 GitHub,4,1,object-detection
/cristianpb/object-detection/blob/master/backend/yolo_detection.py,object-detection/backend/yolo_detection.py at master 路 cristianpb/object-dete...,2,1,object-detection
/cristianpb/object-detection/blob/master/models/ssd_mobilenet/ssd_mobilenet_v2_coco_2018_03_29.pbtxt,object-detection/models/ssd_mobilenet/ssd_mobilenet_v2_coco_2018_03_29.pbtxt ...,2,1,object-detection
/cristianpb/object-detection/blob/master/README.md,object-detection/README.md at master 路 cristianpb/object-detection 路 GitHub,2,1,object-detection
/cristianpb/object-detection/blob/master/tests/test_detection.py,object-detection/tests/test_detection.py at master 路 cristianpb/object-detect...,2,1,object-detection
/cristianpb/object-detection-frontend/tree/master/src,object-detection-frontend/src at master 路 cristianpb/object-detection-frontend,5,2,object-detection-frontend
/cristianpb/object-detection-frontend,GitHub - cristianpb/object-detection-frontend: Frontend Angular application f...,2,2,object-detection-frontend
/cristianpb/object-detection-frontend/blob/master/src/app/camera/camera.component.html,object-detection-frontend/src/app/camera/camera.component.html at master 路 cr...,2,1,object-detection-frontend
/cristianpb/object-detection-frontend/tree/master/e2e,object-detection-frontend/e2e at master 路 cristianpb/object-detection-fronten...,2,1,object-detection-frontend
/cristianpb/rhasspy-handler/issues/4,"""node index.js"" breaks with 'Error: Cannot find module 'onoff'' 路 Issue #4 路 ...",2,2,rhasspy-handler
/cristianpb/telegraf-influxdb-grafana-docker/blob/master/docker-compose.yml,telegraf-influxdb-grafana-docker/docker-compose.yml at master 路 cristianpb/te...,10,3,telegraf-influxdb-grafana-docker
/cristianpb/telegraf-influxdb-grafana-docker,"GitHub - cristianpb/telegraf-influxdb-grafana-docker: telegraf, influxdb and ...",6,5,telegraf-influxdb-grafana-docker
/cristianpb/telegraf-influxdb-grafana-docker/blob/master/docker-compose-gpu.yml,telegraf-influxdb-grafana-docker/docker-compose-gpu.yml at master 路 cristianp...,6,2,telegraf-influxdb-grafana-docker
/cristianpb/telegraf-influxdb-grafana-docker/blob/master/docker/telegraf/telegraf.conf,telegraf-influxdb-grafana-docker/docker/telegraf/telegraf.conf at master 路 cr...,6,2,telegraf-influxdb-grafana-docker
/cristianpb/telegraf-influxdb-grafana-docker/tree/master/docker/telegraf,telegraf-influxdb-grafana-docker/docker/telegraf at master 路 cristianpb/teleg...,5,1,telegraf-influxdb-grafana-docker
/cristianpb/telegraf-influxdb-grafana-docker/tree/master/docker,telegraf-influxdb-grafana-docker/docker at master 路 cristianpb/telegraf-influ...,3,1,telegraf-influxdb-grafana-docker
/cristianpb/telegraf-influxdb-grafana-docker/tree/master,"cristianpb/telegraf-influxdb-grafana-docker: telegraf, influxdb and grafana m...",2,2,telegraf-influxdb-grafana-docker
/cristianpb/telegraf-influxdb-grafana-docker/blob/master/Makefile,telegraf-influxdb-grafana-docker/Makefile at master 路 cristianpb/telegraf-inf...,2,1,telegraf-influxdb-grafana-docker
/cristianpb/telegraf-influxdb-grafana-docker/blob/master/schema.png,telegraf-influxdb-grafana-docker/schema.png at master 路 cristianpb/telegraf-i...,2,1,telegraf-influxdb-grafana-docker
/cristianpb/vimwiki,cristianpb/vimwiki: My vimwiki,20,2,vimwiki
/cristianpb/vimwiki/tree/master/content,vimwiki/content at master 路 cristianpb/vimwiki,17,2,vimwiki
/cristianpb/vimwiki/blob/master/config.toml,vimwiki/config.toml at master 路 cristianpb/vimwiki,9,1,vimwiki
/cristianpb/vimwiki/tree/master,cristianpb/vimwiki: My vimwiki,6,2,vimwiki
/cristianpb/vimwiki/tree/master/layouts,vimwiki/layouts at master 路 cristianpb/vimwiki,6,1,vimwiki
/cristianpb/vimwiki/blob/master/config-gh.toml,vimwiki/config-gh.toml at master 路 cristianpb/vimwiki,4,1,vimwiki
/cristianpb/vimwiki/blob/master/.gitignore,vimwiki/.gitignore at master 路 cristianpb/vimwiki,4,1,vimwiki
/cristianpb/vimwiki/blob/master/layouts/index.html,vimwiki/layouts/index.html at master 路 cristianpb/vimwiki,4,1,vimwiki
/cristianpb/vimwiki/blob/master/content/arch_linux.md,vimwiki/content/arch_linux.md at master 路 cristianpb/vimwiki,2,1,vimwiki
/cristianpb/vimwiki/blob/master/.github/workflows/publish.yml,vimwiki/.github/workflows/publish.yml at master 路 cristianpb/vimwiki,2,1,vimwiki
