path,title,count,uniques,repository
/cristianpb/analytics-google,GitHub - cristianpb/analytics-google: Google analytics from cristianpb.github...,5,5,analytics-google
/cristianpb/analytics-google/actions/workflows/data.yml,Actions 路 cristianpb/analytics-google 路 GitHub,5,1,analytics-google
/cristianpb/analytics-google/actions,Actions 路 cristianpb/analytics-google 路 GitHub,4,1,analytics-google
/cristianpb/analytics-google/actions/workflows/build.yml,Actions 路 cristianpb/analytics-google 路 GitHub,3,1,analytics-google
/cristianpb/analytics-google/actions/runs/1669555503, Sort github data by date 路 cristianpb/analytics-google@328f9fe 路 GitHub,1,1,analytics-google
/cristianpb/analytics-google/blob/master/.github/workflows/build.yml,analytics-google/build.yml at master 路 cristianpb/analytics-google 路 GitHub,1,1,analytics-google
/cristianpb/analytics-google/blob/master/.github/workflows/data.yml,analytics-google/data.yml at master 路 cristianpb/analytics-google 路 GitHub,1,1,analytics-google
/cristianpb/aws-lambda-cv,"GitHub - cristianpb/aws-lambda-cv: Computer Vision, with AWS Lambda",11,2,aws-lambda-cv
/cristianpb/aws-lambda-cv/blob/master/swagger.yaml,aws-lambda-cv/swagger.yaml at master 路 cristianpb/aws-lambda-cv 路 GitHub,3,2,aws-lambda-cv
/cristianpb/aws-lambda-cv/blob/master/lambda_function.py,aws-lambda-cv/lambda_function.py at master 路 cristianpb/aws-lambda-cv 路 GitHub,2,2,aws-lambda-cv
/cristianpb/aws-lambda-cv/blob/master/template.yaml,aws-lambda-cv/template.yaml at master 路 cristianpb/aws-lambda-cv,2,1,aws-lambda-cv
/cristianpb/aws-lambda-cv/blob/master/requirements.txt,aws-lambda-cv/requirements.txt at master 路 cristianpb/aws-lambda-cv,1,1,aws-lambda-cv
/cristianpb/aws-lambda-cv/branches,Branches 路 cristianpb/aws-lambda-cv,1,1,aws-lambda-cv
/cristianpb/aws-lambda-cv/tree/master/.github/workflows,aws-lambda-cv/.github/workflows at master 路 cristianpb/aws-lambda-cv,1,1,aws-lambda-cv
/cristianpb/aws-lambda-cv/tree/master/test,aws-lambda-cv/test at master 路 cristianpb/aws-lambda-cv,1,1,aws-lambda-cv
/cristianpb/cristianpb.github.io,GitHub - cristianpb/cristianpb.github.io: My website,2,2,cristianpb.github.io
/cristianpb/cristianpb.github.io/blob/master/jekyll_collections/_pages/index.html,cristianpb.github.io/index.html at master 路 cristianpb/cristianpb.github.io 路...,1,1,cristianpb.github.io
/cristianpb/cristianpb.github.io/tree/master/_data,cristianpb.github.io/_data at master 路 cristianpb/cristianpb.github.io 路 GitHub,1,1,cristianpb.github.io
/cristianpb/cristianpb.github.io/tree/master/jekyll_collections,cristianpb.github.io/jekyll_collections at master 路 cristianpb/cristianpb.git...,1,1,cristianpb.github.io
/cristianpb/cristianpb.github.io/tree/master/jekyll_collections/_pages,cristianpb.github.io/jekyll_collections/_pages at master 路 cristianpb/cristia...,1,1,cristianpb.github.io
/cristianpb/dotfiles,GitHub - cristianpb/dotfiles: My dotfiles,5,4,dotfiles
/cristianpb/dotfiles/tree/master/ranger/.config/ranger,dotfiles/ranger/.config/ranger at master 路 cristianpb/dotfiles 路 GitHub,3,3,dotfiles
/cristianpb/dotfiles/blob/master/ranger/.config/ranger/rc.conf,dotfiles/rc.conf at master 路 cristianpb/dotfiles 路 GitHub,2,2,dotfiles
/cristianpb/dotfiles/blob/master/ranger/.config/ranger/scope.sh,dotfiles/scope.sh at master 路 cristianpb/dotfiles 路 GitHub,2,2,dotfiles
/cristianpb/dotfiles/tree/master/bash,dotfiles/bash at master 路 cristianpb/dotfiles,2,1,dotfiles
/cristianpb/dotfiles/blob/545a06fce5ee60bcda16d1e7a82f359b0d845df1/ranger/.config/ranger/scope.sh,dotfiles/scope.sh at 545a06fce5ee60bcda16d1e7a82f359b0d845df1 路 cristianpb/do...,1,1,dotfiles
/cristianpb/dotfiles/blob/master/bash/.bash_profile,dotfiles/.bash_profile at master 路 cristianpb/dotfiles,1,1,dotfiles
/cristianpb/dotfiles/blob/master/bash/.bashrc,dotfiles/.bashrc at master 路 cristianpb/dotfiles,1,1,dotfiles
/cristianpb/dotfiles/blob/master/bash/.shell_prompt.sh,dotfiles/.shell_prompt.sh at master 路 cristianpb/dotfiles,1,1,dotfiles
/cristianpb/dotfiles/blob/master/git/.gitconfig,dotfiles/.gitconfig at master 路 cristianpb/dotfiles,1,1,dotfiles
/cristianpb/muse,GitHub - cristianpb/muse: Mopidy web client with Snapcast support,48,14,muse
/cristianpb/muse/tree/master/mopidy_muse,muse/mopidy_muse at master 路 cristianpb/muse 路 GitHub,12,2,muse
/cristianpb/muse/tree/master/src,muse/src at master 路 cristianpb/muse 路 GitHub,10,3,muse
/cristianpb/muse/blob/master/mopidy_muse/mopidy.conf,muse/mopidy.conf at master 路 cristianpb/muse 路 GitHub,8,2,muse
/cristianpb/muse/tree/master/src/tools,muse/src/tools at master 路 cristianpb/muse 路 GitHub,7,2,muse
/cristianpb/muse/blob/master/docker-compose.yml,muse/docker-compose.yml at master 路 cristianpb/muse 路 GitHub,7,1,muse
/cristianpb/muse/blob/master/Dockerfile-base,muse/Dockerfile-base at master 路 cristianpb/muse 路 GitHub,6,1,muse
/cristianpb/muse/issues,Issues 路 cristianpb/muse 路 GitHub,5,4,muse
/cristianpb/muse/blob/master/src/tools/mopidyTools.js,muse/mopidyTools.js at master 路 cristianpb/muse 路 GitHub,5,1,muse
/cristianpb/muse/blob/master/src/tools/snapcast.js,muse/snapcast.js at master 路 cristianpb/muse 路 GitHub,5,1,muse
/cristianpb/object-detection,"GitHub - cristianpb/object-detection: Object detection on Jetson Nano, Raspbe...",45,29,object-detection
/cristianpb/object-detection/blob/master/backend/ssd_detection.py,object-detection/ssd_detection.py at master 路 cristianpb/object-detection 路 G...,12,9,object-detection
/cristianpb/object-detection/blob/master/backend/yolo_detection.py,object-detection/yolo_detection.py at master 路 cristianpb/object-detection 路 ...,10,8,object-detection
/cristianpb/object-detection/tree/master/backend,object-detection/backend at master 路 cristianpb/object-detection 路 GitHub,8,5,object-detection
/cristianpb/object-detection/blob/master/requirements.txt,object-detection/requirements.txt at master 路 cristianpb/object-detection 路 G...,4,2,object-detection
/cristianpb/object-detection/tree/master/tests,object-detection/tests at master 路 cristianpb/object-detection 路 GitHub,4,2,object-detection
/cristianpb/object-detection/blob/master/Makefile,object-detection/Makefile at master 路 cristianpb/object-detection 路 GitHub,3,2,object-detection
/cristianpb/object-detection/blob/master/backend/ssd_trt_detection.py,object-detection/ssd_trt_detection.py at master 路 cristianpb/object-detection...,2,2,object-detection
/cristianpb/object-detection/blob/master/setup.py,object-detection/setup.py at master 路 cristianpb/object-detection 路 GitHub,2,2,object-detection
/cristianpb/object-detection/search,Search 路 object-detection vue,2,2,object-detection
/cristianpb/object-detection-frontend,GitHub - cristianpb/object-detection-frontend: Frontend Angular application f...,6,5,object-detection-frontend
/cristianpb/object-detection-frontend/tree/master/src/app,object-detection-frontend/src/app at master 路 cristianpb/object-detection-fro...,3,2,object-detection-frontend
/cristianpb/object-detection-frontend/tree/master/src/app/cameras,object-detection-frontend/src/app/cameras at master 路 cristianpb/object-detec...,3,1,object-detection-frontend
/cristianpb/object-detection-frontend/tree/master/src,object-detection-frontend/src at master 路 cristianpb/object-detection-frontend,2,2,object-detection-frontend
/cristianpb/object-detection-frontend/blob/master/src/app/app.component.html,object-detection-frontend/app.component.html at master 路 cristianpb/object-de...,1,1,object-detection-frontend
/cristianpb/object-detection-frontend/blob/master/src/app/cameras/cameras.component.html,object-detection-frontend/cameras.component.html at master 路 cristianpb/objec...,1,1,object-detection-frontend
/cristianpb/object-detection-frontend/blob/master/src/app/cameras/cameras.component.ts,object-detection-frontend/cameras.component.ts at master 路 cristianpb/object-...,1,1,object-detection-frontend
/cristianpb/priceminister,GitHub - cristianpb/priceminister: Data science projet on nlp,1,1,priceminister
/cristianpb/priceminister/actions,Actions 路 cristianpb/priceminister 路 GitHub,1,1,priceminister
/cristianpb/priceminister/blob/master/notebooks/01-Exploration.ipynb,priceminister/01-Exploration.ipynb at master 路 cristianpb/priceminister 路 Git...,1,1,priceminister
/cristianpb/priceminister/blob/master/notebooks/02-Train.ipynb,priceminister/02-Train.ipynb at master 路 cristianpb/priceminister 路 GitHub,1,1,priceminister
/cristianpb/priceminister/blob/master/notebooks/03-Word%20embeddings.ipynb,priceminister/03-Word embeddings.ipynb at master 路 cristianpb/priceminister 路...,1,1,priceminister
/cristianpb/priceminister/blob/master/notebooks/04-Ensembling.ipynb,priceminister/04-Ensembling.ipynb at master 路 cristianpb/priceminister 路 GitHub,1,1,priceminister
/cristianpb/priceminister/blob/master/notebooks/05-Prediction.ipynb,priceminister/05-Prediction.ipynb at master 路 cristianpb/priceminister 路 GitHub,1,1,priceminister
/cristianpb/priceminister/tree/master/notebooks,priceminister/notebooks at master 路 cristianpb/priceminister 路 GitHub,1,1,priceminister
/cristianpb/rhasspy-handler/issues/4,"""node index.js"" breaks with 'Error: Cannot find module 'onoff'' 路 Issue #4 路 ...",9,8,rhasspy-handler
/cristianpb/telegraf-influxdb-grafana-docker/blob/master/docker-compose.yml,telegraf-influxdb-grafana-docker/docker-compose.yml at master 路 cristianpb/te...,10,4,telegraf-influxdb-grafana-docker
/cristianpb/telegraf-influxdb-grafana-docker,"GitHub - cristianpb/telegraf-influxdb-grafana-docker: telegraf, influxdb and ...",8,5,telegraf-influxdb-grafana-docker
/cristianpb/telegraf-influxdb-grafana-docker/tree/master/docker/grafana,telegraf-influxdb-grafana-docker/docker/grafana at master 路 cristianpb/telegr...,5,3,telegraf-influxdb-grafana-docker
/cristianpb/telegraf-influxdb-grafana-docker/tree/master/docker,telegraf-influxdb-grafana-docker/docker at master 路 cristianpb/telegraf-influ...,5,2,telegraf-influxdb-grafana-docker
/cristianpb/telegraf-influxdb-grafana-docker/blob/master/docker/influxdb/influxdb.conf,telegraf-influxdb-grafana-docker/influxdb.conf at master 路 cristianpb/telegra...,4,4,telegraf-influxdb-grafana-docker
/cristianpb/telegraf-influxdb-grafana-docker/blob/master/.env_dist,telegraf-influxdb-grafana-docker/.env_dist at master 路 cristianpb/telegraf-in...,3,3,telegraf-influxdb-grafana-docker
/cristianpb/telegraf-influxdb-grafana-docker/blob/master/docker/telegraf/telegraf.conf,telegraf-influxdb-grafana-docker/telegraf.conf at master 路 cristianpb/telegra...,3,1,telegraf-influxdb-grafana-docker
/cristianpb/telegraf-influxdb-grafana-docker/tree/master/docker/telegraf,telegraf-influxdb-grafana-docker/docker/telegraf at master 路 cristianpb/teleg...,3,1,telegraf-influxdb-grafana-docker
/cristianpb/telegraf-influxdb-grafana-docker/blob/master/docker/grafana/DashboardTelegraf.json,telegraf-influxdb-grafana-docker/DashboardTelegraf.json at master 路 cristianp...,2,1,telegraf-influxdb-grafana-docker
/cristianpb/telegraf-influxdb-grafana-docker/blob/master/docker/grafana/dashboard.yaml,telegraf-influxdb-grafana-docker/dashboard.yaml at master 路 cristianpb/telegr...,1,1,telegraf-influxdb-grafana-docker
/cristianpb/vimwiki,GitHub - cristianpb/vimwiki: My vimwiki,2,2,vimwiki
