path,title,count,uniques,repository
/cristianpb/analytics-google/actions/runs/5650203644,Get data from GA 路 cristianpb/analytics-google@328f9fe 路 GitHub,3,2,analytics-google
/cristianpb/analytics-google/actions/runs/5650203644/job/15306139029,Get data from GA 路 cristianpb/analytics-google@328f9fe 路 GitHub,3,2,analytics-google
/cristianpb/analytics-google,cristianpb/analytics-google: Google analytics from cristianpb.github.io,2,2,analytics-google
/cristianpb/analytics-google/blob/master/analytics.py,analytics-google/analytics.py at master 路 cristianpb/analytics-google,2,1,analytics-google
/cristianpb/cristianpb,GitHub - cristianpb/cristianpb,1,1,cristianpb
/cristianpb/cristianpb.github.io,cristianpb/cristianpb.github.io: My website,2,2,cristianpb.github.io
/cristianpb/cristianpb.github.io/actions,Actions 路 cristianpb/cristianpb.github.io,1,1,cristianpb.github.io
/cristianpb/cristianpb.github.io/actions/runs/5661442538/job/15339336705, Update to GA4 路 cristianpb/cristianpb.github.io@d4735af,1,1,cristianpb.github.io
/cristianpb/dotfiles/tree/master/vim,dotfiles/vim at master 路 cristianpb/dotfiles 路 GitHub,5,2,dotfiles
/cristianpb/dotfiles/tree/master/ranger/.config/ranger,dotfiles/ranger/.config/ranger at master 路 cristianpb/dotfiles 路 GitHub,4,2,dotfiles
/cristianpb/dotfiles/blob/master/wiki2html.sh,dotfiles/wiki2html.sh at master 路 cristianpb/dotfiles 路 GitHub,4,1,dotfiles
/cristianpb/dotfiles/blob/master/ranger/.config/ranger/rc.conf,dotfiles/ranger/.config/ranger/rc.conf at master 路 cristianpb/dotfiles,2,1,dotfiles
/cristianpb/dotfiles/blob/master/vim/.vimrc,dotfiles/vim/.vimrc at master 路 cristianpb/dotfiles 路 GitHub,2,1,dotfiles
/cristianpb/dotfiles,GitHub - cristianpb/dotfiles: My dotfiles,1,1,dotfiles
/cristianpb/muse,GitHub - cristianpb/muse: Mopidy web client with Snapcast support,12,6,muse
/cristianpb/muse/issues,Issues 路 cristianpb/muse 路 GitHub,2,1,muse
/cristianpb/muse/forks,Forks 路 cristianpb/muse 路 GitHub,1,1,muse
/cristianpb/muse/issues/8,Play all from search results doesn't do anything 路 Issue #8 路 cristianpb/muse...,1,1,muse
/cristianpb/muse/network/members,Forks 路 cristianpb/muse 路 GitHub,1,1,muse
/cristianpb/object-detection/blob/master/backend/yolo_detection.py,object-detection/backend/yolo_detection.py at master 路 cristianpb/object-dete...,10,4,object-detection
/cristianpb/object-detection,"GitHub - cristianpb/object-detection: Object detection on Jetson Nano, Raspbe...",9,9,object-detection
/cristianpb/object-detection/tree/master/models,object-detection/models at master 路 cristianpb/object-detection,9,1,object-detection
/cristianpb/object-detection/blob/master/docker-compose.yml,object-detection/docker-compose.yml at master 路 cristianpb/object-detection 路...,2,1,object-detection
/cristianpb/object-detection/tree/master,object-detection/ at master 路 cristianpb/object-detection,2,1,object-detection
/cristianpb/object-detection/tree/master/models/cascade,object-detection/models/cascade at master 路 cristianpb/object-detection,2,1,object-detection
/cristianpb/object-detection/tree/master/models/ssd_mobilenet,object-detection/models/ssd_mobilenet at master 路 cristianpb/object-detection,2,1,object-detection
/cristianpb/object-detection/tree/master/models/yolo,object-detection/models/yolo at master 路 cristianpb/object-detection,2,1,object-detection
/cristianpb/object-detection-frontend,GitHub - cristianpb/object-detection-frontend: Frontend Angular application f...,7,5,object-detection-frontend
/cristianpb/rhasspy-handler/issues/4,"""node index.js"" breaks with 'Error: Cannot find module 'onoff'' 路 Issue #4 路 ...",6,5,rhasspy-handler
/cristianpb/telegraf-influxdb-grafana-docker/blob/master/docker-compose.yml,telegraf-influxdb-grafana-docker/docker-compose.yml at master 路 cristianpb/te...,10,4,telegraf-influxdb-grafana-docker
/cristianpb/telegraf-influxdb-grafana-docker/tree/master/docker,telegraf-influxdb-grafana-docker/docker at master 路 cristianpb/telegraf-influ...,10,4,telegraf-influxdb-grafana-docker
/cristianpb/telegraf-influxdb-grafana-docker/tree/master/docker/telegraf,telegraf-influxdb-grafana-docker/docker/telegraf at master 路 cristianpb/teleg...,7,3,telegraf-influxdb-grafana-docker
/cristianpb/telegraf-influxdb-grafana-docker,"GitHub - cristianpb/telegraf-influxdb-grafana-docker: telegraf, influxdb and ...",5,5,telegraf-influxdb-grafana-docker
/cristianpb/telegraf-influxdb-grafana-docker/blob/master/docker/telegraf/telegraf-gpu.conf,telegraf-influxdb-grafana-docker/docker/telegraf/telegraf-gpu.conf at master ...,4,2,telegraf-influxdb-grafana-docker
/cristianpb/telegraf-influxdb-grafana-docker/blob/master/.env_dist,telegraf-influxdb-grafana-docker/.env_dist at master 路 cristianpb/telegraf-in...,3,1,telegraf-influxdb-grafana-docker
/cristianpb/telegraf-influxdb-grafana-docker/blob/master/Makefile,telegraf-influxdb-grafana-docker/Makefile at master 路 cristianpb/telegraf-inf...,3,1,telegraf-influxdb-grafana-docker
/cristianpb/telegraf-influxdb-grafana-docker/blob/master/docker-compose-gpu.yml,telegraf-influxdb-grafana-docker/docker-compose-gpu.yml at master 路 cristianp...,2,1,telegraf-influxdb-grafana-docker
/cristianpb/telegraf-influxdb-grafana-docker/blob/master/docker/telegraf/telegraf.conf,telegraf-influxdb-grafana-docker/docker/telegraf/telegraf.conf at master 路 cr...,2,1,telegraf-influxdb-grafana-docker
/cristianpb/telegraf-influxdb-grafana-docker/tree/master,"cristianpb/telegraf-influxdb-grafana-docker: telegraf, influxdb and grafana m...",1,1,telegraf-influxdb-grafana-docker
/cristianpb/vimwiki,GitHub - cristianpb/vimwiki: My vimwiki,1,1,vimwiki
/cristianpb/vimwiki/commit/ddbd9f46fe6d83e12172ae0d253d9e85d1ab7034, Update css in banner title 路 cristianpb/vimwiki@ddbd9f4 路 GitHub,1,1,vimwiki
/cristianpb/vimwiki/pulls,Pull requests 路 cristianpb/vimwiki 路 GitHub,1,1,vimwiki
