path,title,count,uniques,repository
/cristianpb/analytics-google/blob/master/Makefile,analytics-google/Makefile at master 路 cristianpb/analytics-google,12,1,analytics-google
/cristianpb/analytics-google/blob/master/requirements.txt,analytics-google/requirements.txt at master 路 cristianpb/analytics-google 路 G...,2,1,analytics-google
/cristianpb/cristianpb.github.io,cristianpb/cristianpb.github.io: My website,1,1,cristianpb.github.io
/cristianpb/dotfiles/tree/master/vim,dotfiles/vim at master 路 cristianpb/dotfiles,11,3,dotfiles
/cristianpb/dotfiles/blob/master/vim/.vimrc,dotfiles/vim/.vimrc at master 路 cristianpb/dotfiles,10,3,dotfiles
/cristianpb/dotfiles,cristianpb/dotfiles: My dotfiles,9,3,dotfiles
/cristianpb/dotfiles/tree/master/nvim/.config/nvim,dotfiles/nvim/.config/nvim at master 路 cristianpb/dotfiles 路 GitHub,6,2,dotfiles
/cristianpb/dotfiles/tree/master/ranger/.config/ranger,dotfiles/ranger/.config/ranger at master 路 cristianpb/dotfiles 路 GitHub,6,2,dotfiles
/cristianpb/dotfiles/blob/master/nvim/.config/nvim/init.vim,dotfiles/nvim/.config/nvim/init.vim at master 路 cristianpb/dotfiles 路 GitHub,4,2,dotfiles
/cristianpb/dotfiles/commits,Commits 路 cristianpb/dotfiles,4,1,dotfiles
/cristianpb/dotfiles/tree/master,dotfiles/ at master 路 cristianpb/dotfiles 路 GitHub,4,1,dotfiles
/cristianpb/dotfiles/blob/master/README.md,dotfiles/README.md at master 路 cristianpb/dotfiles,3,1,dotfiles
/cristianpb/dotfiles/blob/master/autolock.sh,dotfiles/autolock.sh at master 路 cristianpb/dotfiles 路 GitHub,2,1,dotfiles
/cristianpb/muse,GitHub - cristianpb/muse: Mopidy web client with Snapcast support,20,8,muse
/cristianpb/muse/blob/master/docker-compose.yml,muse/docker-compose.yml at master 路 cristianpb/muse 路 GitHub,12,2,muse
/cristianpb/muse/tree/master/mopidy_muse,muse/mopidy_muse at master 路 cristianpb/muse 路 GitHub,10,1,muse
/cristianpb/muse/issues,Issues 路 cristianpb/muse 路 GitHub,7,3,muse
/cristianpb/muse/blob/master/mopidy_muse/mopidy.conf,muse/mopidy_muse/mopidy.conf at master 路 cristianpb/muse 路 GitHub,4,1,muse
/cristianpb/muse/tree/master/src/routes,muse/src/routes at master 路 cristianpb/muse 路 GitHub,4,1,muse
/cristianpb/muse/commits/master,Commits 路 cristianpb/muse 路 GitHub,3,1,muse
/cristianpb/muse/tree/master/cypress,muse/cypress at master 路 cristianpb/muse 路 GitHub,3,1,muse
/cristianpb/muse/tree/master/.github/workflows,muse/.github/workflows at master 路 cristianpb/muse 路 GitHub,3,1,muse
/cristianpb/muse/actions/runs/8313654861/job/22749884481, Remove mopidy base image 路 cristianpb/muse@13bd65e 路 GitHub,2,2,muse
/cristianpb/music-s3,GitHub - cristianpb/music-s3,5,2,music-s3
/cristianpb/music-s3/blob/master/Makefile,music-s3/Makefile at master 路 cristianpb/music-s3 路 GitHub,4,1,music-s3
/cristianpb/music-s3/actions/runs/8335094392,Workflow 路 cristianpb/music-s3@3d50b3c,2,1,music-s3
/cristianpb/music-s3/commits/master,Commits 路 cristianpb/music-s3,2,1,music-s3
/cristianpb/music-s3/actions,Workflow runs 路 cristianpb/music-s3 路 GitHub,1,1,music-s3
/cristianpb/music-s3/actions/runs/8335094392/job/22809918624,Workflow 路 cristianpb/music-s3@3d50b3c,1,1,music-s3
/cristianpb/music-s3/commit/3d50b3cf0f545469e8ee21a7ffd340033b957792, Use make file push and purge target 路 cristianpb/music-s3@3d50b3c,1,1,music-s3
/cristianpb/music-s3/tree/master,GitHub - cristianpb/music-s3,1,1,music-s3
/cristianpb/object-detection/blob/master/backend/yolo_detection.py,object-detection/backend/yolo_detection.py at master 路 cristianpb/object-dete...,8,4,object-detection
/cristianpb/object-detection/blob/master/backend/ssd_detection.py,object-detection/backend/ssd_detection.py at master 路 cristianpb/object-detec...,8,3,object-detection
/cristianpb/object-detection,"GitHub - cristianpb/object-detection: Object detection on Jetson Nano, Raspbe...",6,5,object-detection
/cristianpb/object-detection/blob/master/config.yml.sample,object-detection/config.yml.sample at master 路 cristianpb/object-detection 路 ...,2,1,object-detection
/cristianpb/object-detection/tree/master,"cristianpb/object-detection: Object detection on Jetson Nano, Raspberry Pi an...",1,1,object-detection
/cristianpb/object-detection-frontend,GitHub - cristianpb/object-detection-frontend: Frontend Angular application f...,6,4,object-detection-frontend
/cristianpb/object-detection-frontend/blob/master/package.json,object-detection-frontend/package.json at master 路 cristianpb/object-detectio...,3,1,object-detection-frontend
/cristianpb/playlists,GitHub - cristianpb/playlists,1,1,playlists
/cristianpb/playlists/tree/gh-pages,GitHub - cristianpb/playlists at gh-pages,1,1,playlists
/cristianpb/rhasspy-handler/tree/master/src,rhasspy-handler/src at master 路 cristianpb/rhasspy-handler,2,1,rhasspy-handler
/cristianpb/rhasspy-handler,cristianpb/rhasspy-handler: My voice assistant intent handler,1,1,rhasspy-handler
/cristianpb/telegraf-influxdb-grafana-docker/tree/master/docker,telegraf-influxdb-grafana-docker/docker at master 路 cristianpb/telegraf-influ...,23,6,telegraf-influxdb-grafana-docker
/cristianpb/telegraf-influxdb-grafana-docker/blob/master/docker-compose.yml,telegraf-influxdb-grafana-docker/docker-compose.yml at master 路 cristianpb/te...,21,5,telegraf-influxdb-grafana-docker
/cristianpb/telegraf-influxdb-grafana-docker/blob/master/docker/telegraf/telegraf.conf,telegraf-influxdb-grafana-docker/docker/telegraf/telegraf.conf at master 路 cr...,14,4,telegraf-influxdb-grafana-docker
/cristianpb/telegraf-influxdb-grafana-docker,"GitHub - cristianpb/telegraf-influxdb-grafana-docker: telegraf, influxdb and ...",11,9,telegraf-influxdb-grafana-docker
/cristianpb/telegraf-influxdb-grafana-docker/tree/master/docker/telegraf,telegraf-influxdb-grafana-docker/docker/telegraf at master 路 cristianpb/teleg...,9,3,telegraf-influxdb-grafana-docker
/cristianpb/telegraf-influxdb-grafana-docker/blob/master/docker-compose-gpu.yml,telegraf-influxdb-grafana-docker/docker-compose-gpu.yml at master 路 cristianp...,5,2,telegraf-influxdb-grafana-docker
/cristianpb/telegraf-influxdb-grafana-docker/blob/master/docker/influxdb/types.db,telegraf-influxdb-grafana-docker/docker/influxdb/types.db at master 路 cristia...,5,2,telegraf-influxdb-grafana-docker
/cristianpb/telegraf-influxdb-grafana-docker/tree/master/docker/grafana,telegraf-influxdb-grafana-docker/docker/grafana at master 路 cristianpb/telegr...,4,2,telegraf-influxdb-grafana-docker
/cristianpb/telegraf-influxdb-grafana-docker/tree/master/docker/influxdb,telegraf-influxdb-grafana-docker/docker/influxdb at master 路 cristianpb/teleg...,4,2,telegraf-influxdb-grafana-docker
/cristianpb/telegraf-influxdb-grafana-docker/tree/master,"GitHub - cristianpb/telegraf-influxdb-grafana-docker: telegraf, influxdb and ...",3,2,telegraf-influxdb-grafana-docker
/cristianpb/vimwiki/tree/master/assets/css,vimwiki/assets/css at master 路 cristianpb/vimwiki,17,2,vimwiki
/cristianpb/vimwiki/tree/master/content,vimwiki/content at master 路 cristianpb/vimwiki,16,2,vimwiki
/cristianpb/vimwiki/blob/master/config.toml,vimwiki/config.toml at master 路 cristianpb/vimwiki,12,2,vimwiki
/cristianpb/vimwiki,GitHub - cristianpb/vimwiki: My vimwiki,9,3,vimwiki
/cristianpb/vimwiki/tree/master/layouts,vimwiki/layouts at master 路 cristianpb/vimwiki 路 GitHub,9,2,vimwiki
/cristianpb/vimwiki/blob/master/config-gh.toml,vimwiki/config-gh.toml at master 路 cristianpb/vimwiki,8,2,vimwiki
/cristianpb/vimwiki/tree/master/.github/workflows,vimwiki/.github/workflows at master 路 cristianpb/vimwiki,7,2,vimwiki
/cristianpb/vimwiki/blob/master/assets/css/main.css,vimwiki/assets/css/main.css at master 路 cristianpb/vimwiki,6,1,vimwiki
/cristianpb/vimwiki/blob/master/content/arch_linux.md,vimwiki/content/arch_linux.md at master 路 cristianpb/vimwiki,4,2,vimwiki
/cristianpb/vimwiki/blob/master/assets/css/dark.css,vimwiki/assets/css/dark.css at master 路 cristianpb/vimwiki,4,1,vimwiki
