path,title,count,uniques,repository
/cristianpb/analytics-google,GitHub - cristianpb/analytics-google: Google analytics from cristianpb.github...,14,4,analytics-google
/cristianpb/analytics-google/tree/master/.github/workflows,analytics-google/.github/workflows at master 路 cristianpb/analytics-google 路 ...,9,1,analytics-google
/cristianpb/analytics-google/blob/master/.github/workflows/build.yml,analytics-google/build.yml at master 路 cristianpb/analytics-google 路 GitHub,5,1,analytics-google
/cristianpb/analytics-google/actions/runs/4759232418,Get data from GA 路 cristianpb/analytics-google@328f9fe 路 GitHub,4,2,analytics-google
/cristianpb/analytics-google/actions/runs/4759232418/jobs/8458278711,Get data from GA 路 cristianpb/analytics-google@328f9fe 路 GitHub,3,2,analytics-google
/cristianpb/analytics-google/actions,Actions 路 cristianpb/analytics-google 路 GitHub,3,1,analytics-google
/cristianpb/analytics-google/blob/master/.github/workflows/data.yml,analytics-google/data.yml at master 路 cristianpb/analytics-google 路 GitHub,2,1,analytics-google
/cristianpb/analytics-google/blob/master/requirements.txt,analytics-google/requirements.txt at master 路 cristianpb/analytics-google 路 G...,2,1,analytics-google
/cristianpb/analytics-google/tree/master/src,analytics-google/src at master 路 cristianpb/analytics-google 路 GitHub,2,1,analytics-google
/cristianpb/analytics-google/actions/runs/4759232418/usage, Sort github data by date 路 cristianpb/analytics-google@328f9fe,1,1,analytics-google
/cristianpb/dotfiles/tree/master/ranger/.config/ranger,dotfiles/ranger/.config/ranger at master 路 cristianpb/dotfiles 路 GitHub,19,4,dotfiles
/cristianpb/dotfiles/blob/master/ranger/.config/ranger/rc.conf,dotfiles/rc.conf at master 路 cristianpb/dotfiles 路 GitHub,8,3,dotfiles
/cristianpb/dotfiles/blob/ubuntu/compton/.compton.conf,dotfiles/.compton.conf at ubuntu 路 cristianpb/dotfiles 路 GitHub,5,1,dotfiles
/cristianpb/dotfiles/tree/ubuntu/top,dotfiles/top at ubuntu 路 cristianpb/dotfiles 路 GitHub,5,1,dotfiles
/cristianpb/dotfiles/blob/master/ranger/.config/ranger/commands_full.py,dotfiles/commands_full.py at master 路 cristianpb/dotfiles 路 GitHub,4,2,dotfiles
/cristianpb/dotfiles/blob/master/ranger/.config/ranger/commands.py,dotfiles/commands.py at master 路 cristianpb/dotfiles 路 GitHub,4,2,dotfiles
/cristianpb/dotfiles/blob/master/ranger/.config/ranger/rifle.conf,dotfiles/rifle.conf at master 路 cristianpb/dotfiles 路 GitHub,4,2,dotfiles
/cristianpb/dotfiles/blob/ubuntu/top/.toprc,dotfiles/.toprc at ubuntu 路 cristianpb/dotfiles 路 GitHub,4,1,dotfiles
/cristianpb/dotfiles/blob/master/vim/.vimrc,dotfiles/.vimrc at master 路 cristianpb/dotfiles 路 GitHub,3,3,dotfiles
/cristianpb/dotfiles/tree/master/ranger/.config,dotfiles/ranger/.config at master 路 cristianpb/dotfiles 路 GitHub,3,1,dotfiles
/cristianpb/muse,GitHub - cristianpb/muse: Mopidy web client with Snapcast support,21,16,muse
/cristianpb/muse/issues,Issues 路 cristianpb/muse 路 GitHub,6,6,muse
/cristianpb/muse/blob/master/docker-compose.yml,muse/docker-compose.yml at master 路 cristianpb/muse 路 GitHub,1,1,muse
/cristianpb/muse/issues/39,Add snapcast stream support 路 Issue #39 路 cristianpb/muse,1,1,muse
/cristianpb/muse/issues/40,Dark mode 路 Issue #40 路 cristianpb/muse,1,1,muse
/cristianpb/muse/issues/42,Searching all backends returns no result 路 Issue #42 路 cristianpb/muse,1,1,muse
/cristianpb/muse/issues/46,Would you put lyrics options? 路 Issue #46 路 cristianpb/muse,1,1,muse
/cristianpb/music-s3,GitHub - cristianpb/music-s3,11,2,music-s3
/cristianpb/music-s3/search,Search 路 路 GitHub,10,1,music-s3
/cristianpb/music-s3/actions/runs/4814312663,Workflow 路 cristianpb/music-s3@2e0a087,2,1,music-s3
/cristianpb/music-s3/actions,Actions 路 cristianpb/music-s3 路 GitHub,1,1,music-s3
/cristianpb/music-s3/actions/runs/4814312663/jobs/8571837775,Workflow 路 cristianpb/music-s3@2e0a087,1,1,music-s3
/cristianpb/object-detection,"GitHub - cristianpb/object-detection: Object detection on Jetson Nano, Raspbe...",21,14,object-detection
/cristianpb/object-detection/blob/master/backend/ssd_detection.py,object-detection/ssd_detection.py at master 路 cristianpb/object-detection 路 G...,7,6,object-detection
/cristianpb/object-detection/blob/master/backend/yolo_detection.py,object-detection/yolo_detection.py at master 路 cristianpb/object-detection 路 ...,6,5,object-detection
/cristianpb/object-detection/tree/master/backend,object-detection/backend at master 路 cristianpb/object-detection 路 GitHub,4,4,object-detection
/cristianpb/object-detection/tree/master/models,object-detection/models at master 路 cristianpb/object-detection 路 GitHub,3,2,object-detection
/cristianpb/object-detection/blob/master/setup.py,object-detection/setup.py at master 路 cristianpb/object-detection 路 GitHub,2,2,object-detection
/cristianpb/object-detection/tree/master/models/ssd_mobilenet,object-detection/models/ssd_mobilenet at master 路 cristianpb/object-detection...,2,2,object-detection
/cristianpb/object-detection/blob/c2abea4ba28d37e2bc9b60416f5b9accdbc2b543/nginx/backend.template,object-detection/backend.template at c2abea4ba28d37e2bc9b60416f5b9accdbc2b543...,2,1,object-detection
/cristianpb/object-detection/blob/master/backend/motion.py,object-detection/motion.py at master 路 cristianpb/object-detection,2,1,object-detection
/cristianpb/object-detection/commit/7308e207862f07d8438d9105fb92a80951b2789d,Add motion detector and cascade filter detection 路 cristianpb/object-detectio...,2,1,object-detection
/cristianpb/object-detection-frontend,GitHub - cristianpb/object-detection-frontend: Frontend Angular application f...,8,6,object-detection-frontend
/cristianpb/qrcode-reader,GitHub - cristianpb/qrcode-reader,2,1,qrcode-reader
/cristianpb/qrcode-reader/tree/master/public,qrcode-reader/public at master 路 cristianpb/qrcode-reader 路 GitHub,2,1,qrcode-reader
/cristianpb/qrcode-reader/blob/master/public/index.html,qrcode-reader/index.html at master 路 cristianpb/qrcode-reader 路 GitHub,1,1,qrcode-reader
/cristianpb/qrcode-reader/tree/master/src,qrcode-reader/src at master 路 cristianpb/qrcode-reader 路 GitHub,1,1,qrcode-reader
/cristianpb/rhasspy-handler/issues/4,"""node index.js"" breaks with 'Error: Cannot find module 'onoff'' 路 Issue #4 路 ...",7,7,rhasspy-handler
/cristianpb/rhasspy-handler,cristianpb/rhasspy-handler: My voice assistant intent handler,1,1,rhasspy-handler
/cristianpb/telegraf-influxdb-grafana-docker/tree/master/docker,telegraf-influxdb-grafana-docker/docker at master 路 cristianpb/telegraf-influ...,29,4,telegraf-influxdb-grafana-docker
/cristianpb/telegraf-influxdb-grafana-docker,"GitHub - cristianpb/telegraf-influxdb-grafana-docker: telegraf, influxdb and ...",20,9,telegraf-influxdb-grafana-docker
/cristianpb/telegraf-influxdb-grafana-docker/blob/master/docker-compose.yml,telegraf-influxdb-grafana-docker/docker-compose.yml at master 路 cristianpb/te...,15,6,telegraf-influxdb-grafana-docker
/cristianpb/telegraf-influxdb-grafana-docker/tree/master/docker/telegraf,telegraf-influxdb-grafana-docker/docker/telegraf at master 路 cristianpb/teleg...,15,3,telegraf-influxdb-grafana-docker
/cristianpb/telegraf-influxdb-grafana-docker/blob/master/docker/telegraf/telegraf.conf,telegraf-influxdb-grafana-docker/telegraf.conf at master 路 cristianpb/telegra...,9,2,telegraf-influxdb-grafana-docker
/cristianpb/telegraf-influxdb-grafana-docker/blob/master/.env_dist,telegraf-influxdb-grafana-docker/.env_dist at master 路 cristianpb/telegraf-in...,7,2,telegraf-influxdb-grafana-docker
/cristianpb/telegraf-influxdb-grafana-docker/tree/master/docker/grafana,telegraf-influxdb-grafana-docker/docker/grafana at master 路 cristianpb/telegr...,6,3,telegraf-influxdb-grafana-docker
/cristianpb/telegraf-influxdb-grafana-docker/blob/master/docker-compose-gpu.yml,telegraf-influxdb-grafana-docker/docker-compose-gpu.yml at master 路 cristianp...,5,2,telegraf-influxdb-grafana-docker
/cristianpb/telegraf-influxdb-grafana-docker/blob/master/docker/grafana/dashboard.yaml,telegraf-influxdb-grafana-docker/dashboard.yaml at master 路 cristianpb/telegr...,4,3,telegraf-influxdb-grafana-docker
/cristianpb/telegraf-influxdb-grafana-docker/blob/master/docker/telegraf/telegraf-gpu.conf,telegraf-influxdb-grafana-docker/telegraf-gpu.conf at master 路 cristianpb/tel...,3,2,telegraf-influxdb-grafana-docker
/cristianpb/vimwiki,GitHub - cristianpb/vimwiki: My vimwiki,7,5,vimwiki
/cristianpb/vimwiki/blob/master/content/index.md,vimwiki/index.md at master 路 cristianpb/vimwiki 路 GitHub,3,1,vimwiki
/cristianpb/vimwiki/tree/master/content,vimwiki/content at master 路 cristianpb/vimwiki 路 GitHub,3,1,vimwiki
/cristianpb/vimwiki/blob/master/config.toml,vimwiki/config.toml at master 路 cristianpb/vimwiki 路 GitHub,2,1,vimwiki
/cristianpb/vimwiki/blob/master/content/amp.md,vimwiki/amp.md at master 路 cristianpb/vimwiki 路 GitHub,2,1,vimwiki
/cristianpb/vimwiki/blob/master/content/_index.md,vimwiki/_index.md at master 路 cristianpb/vimwiki 路 GitHub,1,1,vimwiki
/cristianpb/vimwiki/blob/master/content/mongodb.md,vimwiki/mongodb.md at master 路 cristianpb/vimwiki 路 GitHub,1,1,vimwiki
/cristianpb/vimwiki/blob/master/content/pass.md,vimwiki/pass.md at master 路 cristianpb/vimwiki 路 GitHub,1,1,vimwiki
/cristianpb/vimwiki/blob/master/content/vimmd.md,vimwiki/vimmd.md at master 路 cristianpb/vimwiki 路 GitHub,1,1,vimwiki
/cristianpb/vimwiki/blob/master/.github/workflows/publish.yml,vimwiki/publish.yml at master 路 cristianpb/vimwiki 路 GitHub,1,1,vimwiki
