path,title,count,uniques,repository
/cristianpb/analytics-google,GitHub - cristianpb/analytics-google: Google analytics from cristianpb.github...,2,2,analytics-google
/cristianpb/cristianpb.github.io,GitHub - cristianpb/cristianpb.github.io: My website,1,1,cristianpb.github.io
/cristianpb/cristianpb.github.io/blob/master/jekyll_collections/_pages/index.html,cristianpb.github.io/index.html at master 路 cristianpb/cristianpb.github.io 路...,1,1,cristianpb.github.io
/cristianpb/cristianpb.github.io/tree/master/_data,cristianpb.github.io/_data at master 路 cristianpb/cristianpb.github.io 路 GitHub,1,1,cristianpb.github.io
/cristianpb/cristianpb.github.io/tree/master/jekyll_collections,cristianpb.github.io/jekyll_collections at master 路 cristianpb/cristianpb.git...,1,1,cristianpb.github.io
/cristianpb/cristianpb.github.io/tree/master/jekyll_collections/_pages,cristianpb.github.io/jekyll_collections/_pages at master 路 cristianpb/cristia...,1,1,cristianpb.github.io
/cristianpb/dotfiles,cristianpb/dotfiles: My dotfiles,3,3,dotfiles
/cristianpb/dotfiles/blob/master/ranger/.config/ranger/rc.conf,dotfiles/rc.conf at master 路 cristianpb/dotfiles 路 GitHub,2,2,dotfiles
/cristianpb/dotfiles/tree/master/ranger/.config/ranger,dotfiles/ranger/.config/ranger at master 路 cristianpb/dotfiles 路 GitHub,2,2,dotfiles
/cristianpb/dotfiles/blob/master/mutt/.mutt/signature,dotfiles/signature at master 路 cristianpb/dotfiles,1,1,dotfiles
/cristianpb/dotfiles/blob/master/nvim/.config/nvim/coc-settings.json,dotfiles/coc-settings.json at master 路 cristianpb/dotfiles,1,1,dotfiles
/cristianpb/dotfiles/blob/master/ranger/.config/ranger/commands.py,dotfiles/commands.py at master 路 cristianpb/dotfiles,1,1,dotfiles
/cristianpb/dotfiles/blob/master/ranger/.config/ranger/rifle.conf,dotfiles/rifle.conf at master 路 cristianpb/dotfiles,1,1,dotfiles
/cristianpb/dotfiles/blob/master/vim/.vimrc,dotfiles/.vimrc at master 路 cristianpb/dotfiles,1,1,dotfiles
/cristianpb/dotfiles/tree/master/nvim/.config/nvim,dotfiles/nvim/.config/nvim at master 路 cristianpb/dotfiles,1,1,dotfiles
/cristianpb/dotfiles/tree/master/vim,dotfiles/vim at master 路 cristianpb/dotfiles,1,1,dotfiles
/cristianpb/muse,GitHub - cristianpb/muse: Mopidy web client with Snapcast support,21,11,muse
/cristianpb/muse/tree/master/src/tools,muse/src/tools at master 路 cristianpb/muse 路 GitHub,6,1,muse
/cristianpb/muse/issues,Issues 路 cristianpb/muse 路 GitHub,5,4,muse
/cristianpb/muse/blob/master/src/tools/mopidyTools.js,muse/mopidyTools.js at master 路 cristianpb/muse 路 GitHub,5,1,muse
/cristianpb/muse/blob/master/src/tools/snapcast.js,muse/snapcast.js at master 路 cristianpb/muse 路 GitHub,5,1,muse
/cristianpb/muse/tree/master/src,muse/src at master 路 cristianpb/muse 路 GitHub,5,1,muse
/cristianpb/muse/blob/master/src/tools/stores.js,muse/stores.js at master 路 cristianpb/muse 路 GitHub,3,1,muse
/cristianpb/muse/commits,Commits 路 cristianpb/muse 路 GitHub,3,1,muse
/cristianpb/muse/actions/runs/121509959/workflow, Bump version automatically in package-lock.json 路 cristianpb/muse@80c3cb5,2,2,muse
/cristianpb/muse/blob/master/docker-compose.yml,muse/docker-compose.yml at master 路 cristianpb/muse 路 GitHub,2,2,muse
/cristianpb/object-detection,"GitHub - cristianpb/object-detection: Object detection on Jetson Nano, Raspbe...",50,25,object-detection
/cristianpb/object-detection/tree/master/backend,object-detection/backend at master 路 cristianpb/object-detection 路 GitHub,15,5,object-detection
/cristianpb/object-detection/blob/master/backend/yolo_detection.py,object-detection/yolo_detection.py at master 路 cristianpb/object-detection 路 ...,10,9,object-detection
/cristianpb/object-detection/blob/master/backend/ssd_detection.py,object-detection/ssd_detection.py at master 路 cristianpb/object-detection 路 G...,8,6,object-detection
/cristianpb/object-detection/blob/master/backend/app.py,object-detection/app.py at master 路 cristianpb/object-detection 路 GitHub,6,1,object-detection
/cristianpb/object-detection/blob/master/backend/motion.py,object-detection/motion.py at master 路 cristianpb/object-detection 路 GitHub,5,2,object-detection
/cristianpb/object-detection/blob/master/setup.py,object-detection/setup.py at master 路 cristianpb/object-detection 路 GitHub,4,3,object-detection
/cristianpb/object-detection/blob/master/requirements.txt,object-detection/requirements.txt at master 路 cristianpb/object-detection 路 G...,4,2,object-detection
/cristianpb/object-detection/tree/master/models,object-detection/models at master 路 cristianpb/object-detection 路 GitHub,4,2,object-detection
/cristianpb/object-detection/tree/master/tests,object-detection/tests at master 路 cristianpb/object-detection 路 GitHub,4,2,object-detection
/cristianpb/object-detection-frontend,GitHub - cristianpb/object-detection-frontend: Frontend Angular application f...,13,7,object-detection-frontend
/cristianpb/object-detection-frontend/blob/master/Dockerfile,object-detection-frontend/Dockerfile at master 路 cristianpb/object-detection-...,2,1,object-detection-frontend
/cristianpb/object-detection-frontend/blob/master/tsconfig.json,object-detection-frontend/tsconfig.json at master 路 cristianpb/object-detecti...,1,1,object-detection-frontend
/cristianpb/object-detection-frontend/tree/master/src,object-detection-frontend/src at master 路 cristianpb/object-detection-frontend,1,1,object-detection-frontend
/cristianpb/object-detection-frontend/tree/master/src/app,object-detection-frontend/src/app at master 路 cristianpb/object-detection-fro...,1,1,object-detection-frontend
/cristianpb/priceminister,GitHub - cristianpb/priceminister: Data science projet on nlp,1,1,priceminister
/cristianpb/priceminister/blob/master/notebooks/01-Exploration.ipynb,priceminister/01-Exploration.ipynb at master 路 cristianpb/priceminister 路 Git...,1,1,priceminister
/cristianpb/priceminister/blob/master/notebooks/02-Train.ipynb,priceminister/02-Train.ipynb at master 路 cristianpb/priceminister 路 GitHub,1,1,priceminister
/cristianpb/priceminister/blob/master/notebooks/03-Word%20embeddings.ipynb,priceminister/03-Word embeddings.ipynb at master 路 cristianpb/priceminister 路...,1,1,priceminister
/cristianpb/priceminister/blob/master/notebooks/04-Ensembling.ipynb,priceminister/04-Ensembling.ipynb at master 路 cristianpb/priceminister 路 GitHub,1,1,priceminister
/cristianpb/priceminister/blob/master/notebooks/05-Prediction.ipynb,priceminister/05-Prediction.ipynb at master 路 cristianpb/priceminister 路 GitHub,1,1,priceminister
/cristianpb/priceminister/tree/master/notebooks,priceminister/notebooks at master 路 cristianpb/priceminister 路 GitHub,1,1,priceminister
/cristianpb/rhasspy-handler/issues/4,"""node index.js"" breaks with 'Error: Cannot find module 'onoff'' 路 Issue #4 路 ...",7,7,rhasspy-handler
/cristianpb/telegraf-influxdb-grafana-docker/blob/master/docker-compose.yml,telegraf-influxdb-grafana-docker/docker-compose.yml at master 路 cristianpb/te...,9,4,telegraf-influxdb-grafana-docker
/cristianpb/telegraf-influxdb-grafana-docker,"GitHub - cristianpb/telegraf-influxdb-grafana-docker: telegraf, influxdb and ...",7,5,telegraf-influxdb-grafana-docker
/cristianpb/telegraf-influxdb-grafana-docker/tree/master/docker/grafana,telegraf-influxdb-grafana-docker/docker/grafana at master 路 cristianpb/telegr...,6,3,telegraf-influxdb-grafana-docker
/cristianpb/telegraf-influxdb-grafana-docker/tree/master/docker,telegraf-influxdb-grafana-docker/docker at master 路 cristianpb/telegraf-influ...,5,2,telegraf-influxdb-grafana-docker
/cristianpb/telegraf-influxdb-grafana-docker/blob/master/docker/influxdb/influxdb.conf,telegraf-influxdb-grafana-docker/influxdb.conf at master 路 cristianpb/telegra...,3,3,telegraf-influxdb-grafana-docker
/cristianpb/telegraf-influxdb-grafana-docker/blob/master/docker/telegraf/telegraf.conf,telegraf-influxdb-grafana-docker/telegraf.conf at master 路 cristianpb/telegra...,3,1,telegraf-influxdb-grafana-docker
/cristianpb/telegraf-influxdb-grafana-docker/tree/master/docker/telegraf,telegraf-influxdb-grafana-docker/docker/telegraf at master 路 cristianpb/teleg...,3,1,telegraf-influxdb-grafana-docker
/cristianpb/telegraf-influxdb-grafana-docker/blob/master/.env_dist,telegraf-influxdb-grafana-docker/.env_dist at master 路 cristianpb/telegraf-in...,2,2,telegraf-influxdb-grafana-docker
/cristianpb/telegraf-influxdb-grafana-docker/blob/master/docker/grafana/DashboardTelegraf.json,telegraf-influxdb-grafana-docker/DashboardTelegraf.json at master 路 cristianp...,2,1,telegraf-influxdb-grafana-docker
/cristianpb/telegraf-influxdb-grafana-docker/blob/master/docker/grafana/dashboard.yaml,telegraf-influxdb-grafana-docker/dashboard.yaml at master 路 cristianpb/telegr...,1,1,telegraf-influxdb-grafana-docker
/cristianpb/vimwiki,cristianpb/vimwiki: My vimwiki,2,2,vimwiki
/cristianpb/vimwiki/blob/master/config.toml,vimwiki/config.toml at master 路 cristianpb/vimwiki,1,1,vimwiki
