path,title,count,uniques,repository
/cristianpb/analytics-google,GitHub - cristianpb/analytics-google: Google analytics from cristianpb.github...,5,4,analytics-google
/cristianpb/cristianpb.github.io,cristianpb/cristianpb.github.io: My website,6,4,cristianpb.github.io
/cristianpb/cristianpb.github.io/tree/master/_data,cristianpb.github.io/_data at master 路 cristianpb/cristianpb.github.io,3,2,cristianpb.github.io
/cristianpb/cristianpb.github.io/blob/master/_layouts/default.html,cristianpb.github.io/default.html at master 路 cristianpb/cristianpb.github.io,2,2,cristianpb.github.io
/cristianpb/cristianpb.github.io/tree/master/jekyll_collections,cristianpb.github.io/jekyll_collections at master 路 cristianpb/cristianpb.git...,2,2,cristianpb.github.io
/cristianpb/cristianpb.github.io/tree/master/_layouts,cristianpb.github.io/_layouts at master 路 cristianpb/cristianpb.github.io,2,2,cristianpb.github.io
/cristianpb/cristianpb.github.io/tree/master/_data/about,cristianpb.github.io/_data/about at master 路 cristianpb/cristianpb.github.io,2,1,cristianpb.github.io
/cristianpb/cristianpb.github.io/blob/c1d8b72099a45d8578717df94c299aa876e069f0/jekyll_collections/_posts/2020-03-07-arduino-mkr-fox.md,cristianpb.github.io/2020-03-07-arduino-mkr-fox.md at c1d8b72099a45d8578717df...,1,1,cristianpb.github.io
/cristianpb/cristianpb.github.io/blob/master/_config.yml,cristianpb.github.io/_config.yml at master 路 cristianpb/cristianpb.github.io,1,1,cristianpb.github.io
/cristianpb/cristianpb.github.io/blob/master/_data/about/articles.yml,cristianpb.github.io/articles.yml at master 路 cristianpb/cristianpb.github.io,1,1,cristianpb.github.io
/cristianpb/cristianpb.github.io/blob/master/gulpfile.js,cristianpb.github.io/gulpfile.js at master 路 cristianpb/cristianpb.github.io,1,1,cristianpb.github.io
/cristianpb/datalab.mi,GitHub - cristianpb/datalab.mi,1,1,datalab.mi
/cristianpb/dotfiles,GitHub - cristianpb/dotfiles: My dotfiles,15,11,dotfiles
/cristianpb/dotfiles/tree/master/ranger/.config/ranger,dotfiles/ranger/.config/ranger at master 路 cristianpb/dotfiles 路 GitHub,4,4,dotfiles
/cristianpb/dotfiles/blob/master/ranger/.config/ranger/rc.conf,dotfiles/rc.conf at master 路 cristianpb/dotfiles 路 GitHub,4,2,dotfiles
/cristianpb/dotfiles/tree/master/ranger,dotfiles/ranger at master 路 cristianpb/dotfiles,3,3,dotfiles
/cristianpb/dotfiles/blob/master/vim/.vimrc,dotfiles/.vimrc at master 路 cristianpb/dotfiles 路 GitHub,2,2,dotfiles
/cristianpb/dotfiles/blob/master/ranger/.config/ranger/scope.sh,dotfiles/scope.sh at master 路 cristianpb/dotfiles 路 GitHub,2,1,dotfiles
/cristianpb/dotfiles/blob/master/README.md,dotfiles/README.md at master 路 cristianpb/dotfiles,2,1,dotfiles
/cristianpb/dotfiles/branches,Branches 路 cristianpb/dotfiles,2,1,dotfiles
/cristianpb/dotfiles/tree/master/mutt,dotfiles/mutt at master 路 cristianpb/dotfiles,2,1,dotfiles
/cristianpb/dotfiles/blob/80d34ec88437633676201668810c6c4a14a33b81/ranger/.config/ranger/commands_full.py,dotfiles/commands_full.py at 80d34ec88437633676201668810c6c4a14a33b81 路 crist...,1,1,dotfiles
/cristianpb/muse,GitHub - cristianpb/muse: Mopidy web client with Snapcast support,32,25,muse
/cristianpb/muse/issues,Issues 路 cristianpb/muse,6,1,muse
/cristianpb/muse/blob/master/setup.cfg,muse/setup.cfg at master 路 cristianpb/muse 路 GitHub,2,1,muse
/cristianpb/muse/blob/master/Makefile,muse/Makefile at master 路 cristianpb/muse,1,1,muse
/cristianpb/muse/blob/master/README.md,muse/README.md at master 路 cristianpb/muse 路 GitHub,1,1,muse
/cristianpb/muse/commit/0b4fbeb48b0286799c14fa57e65f3e6eaf6314b8, Change name to Muse 路 cristianpb/muse@0b4fbeb 路 GitHub,1,1,muse
/cristianpb/muse/commits/master,Commits 路 cristianpb/muse 路 GitHub,1,1,muse
/cristianpb/muse/issues/23,"Tunein ""Now Playing"" song info does not update 路 Issue #23 路 cristianpb/muse",1,1,muse
/cristianpb/muse/tree/master/mopidy_muse,muse/mopidy_muse at master 路 cristianpb/muse,1,1,muse
/cristianpb/muse/tree/master/mopidy_muse/static,muse/mopidy_muse/static at master 路 cristianpb/muse,1,1,muse
/cristianpb/object-detection,"GitHub - cristianpb/object-detection: Object detection on Jetson Nano, Raspbe...",103,58,object-detection
/cristianpb/object-detection/tree/master/backend,object-detection/backend at master 路 cristianpb/object-detection 路 GitHub,40,19,object-detection
/cristianpb/object-detection/blob/master/backend/ssd_detection.py,object-detection/ssd_detection.py at master 路 cristianpb/object-detection 路 G...,29,16,object-detection
/cristianpb/object-detection/blob/master/backend/yolo_detection.py,object-detection/yolo_detection.py at master 路 cristianpb/object-detection 路 ...,14,12,object-detection
/cristianpb/object-detection/tree/master/models,object-detection/models at master 路 cristianpb/object-detection 路 GitHub,12,8,object-detection
/cristianpb/object-detection/blob/master/backend/camera.py,object-detection/camera.py at master 路 cristianpb/object-detection 路 GitHub,9,6,object-detection
/cristianpb/object-detection/search,Search 路 celery 路 GitHub,9,2,object-detection
/cristianpb/object-detection/tree/master/models/ssd_mobilenet,object-detection/models/ssd_mobilenet at master 路 cristianpb/object-detection...,7,5,object-detection
/cristianpb/object-detection/tree/master/imgs,object-detection/imgs at master 路 cristianpb/object-detection 路 GitHub,6,5,object-detection
/cristianpb/object-detection/blob/master/backend/app.py,object-detection/app.py at master 路 cristianpb/object-detection 路 GitHub,6,4,object-detection
/cristianpb/object-detection-frontend,GitHub - cristianpb/object-detection-frontend: Frontend Angular application f...,20,8,object-detection-frontend
/cristianpb/object-detection-frontend/blob/master/src/test.ts,object-detection-frontend/test.ts at master 路 cristianpb/object-detection-fro...,1,1,object-detection-frontend
/cristianpb/object-detection-frontend/blob/master/tsconfig.json,object-detection-frontend/tsconfig.json at master 路 cristianpb/object-detecti...,1,1,object-detection-frontend
/cristianpb/object-detection-frontend/tree/master/e2e,object-detection-frontend/e2e at master 路 cristianpb/object-detection-frontend,1,1,object-detection-frontend
/cristianpb/object-detection-frontend/tree/master/e2e/src,object-detection-frontend/e2e/src at master 路 cristianpb/object-detection-fro...,1,1,object-detection-frontend
/cristianpb/object-detection-frontend/tree/master/src,object-detection-frontend/src at master 路 cristianpb/object-detection-frontend,1,1,object-detection-frontend
/cristianpb/rhasspy-handler/issues/4,"""node index.js"" breaks with 'Error: Cannot find module 'onoff'' 路 Issue #4 路 ...",12,11,rhasspy-handler
/cristianpb/rhasspy-handler,GitHub - cristianpb/rhasspy-handler: My voice assistant intent handler,3,3,rhasspy-handler
/cristianpb/rhasspy-handler/tree/master/src,rhasspy-handler/src at master 路 cristianpb/rhasspy-handler,2,2,rhasspy-handler
/cristianpb/rhasspy-handler/blob/master/src/podcasts.ts,rhasspy-handler/podcasts.ts at master 路 cristianpb/rhasspy-handler,1,1,rhasspy-handler
/cristianpb/rhasspy-handler/blob/master/src/radios.ts,rhasspy-handler/radios.ts at master 路 cristianpb/rhasspy-handler,1,1,rhasspy-handler
/cristianpb/rhasspy-handler/blob/master/src/rhasspymopidy.ts,rhasspy-handler/rhasspymopidy.ts at master 路 cristianpb/rhasspy-handler,1,1,rhasspy-handler
/cristianpb/rhasspy-handler/commits,Commits 路 cristianpb/rhasspy-handler,1,1,rhasspy-handler
/cristianpb/stats,GitHub - cristianpb/stats,3,1,stats
/cristianpb/stats/tree/gh-pages,GitHub - cristianpb/stats at gh-pages,3,1,stats
/cristianpb/stats/blob/gh-pages/github-referrers.csv,stats/github-referrers.csv at gh-pages 路 cristianpb/stats 路 GitHub,2,1,stats
/cristianpb/stats/actions,Actions 路 cristianpb/stats 路 GitHub,1,1,stats
/cristianpb/stats/blob/gh-pages/github-detailled-visits.csv,stats/github-detailled-visits.csv at gh-pages 路 cristianpb/stats 路 GitHub,1,1,stats
/cristianpb/telegraf-influxdb-grafana-docker,"GitHub - cristianpb/telegraf-influxdb-grafana-docker: telegraf, influxdb and ...",17,9,telegraf-influxdb-grafana-docker
/cristianpb/telegraf-influxdb-grafana-docker/blob/master/docker-compose.yml,telegraf-influxdb-grafana-docker/docker-compose.yml at master 路 cristianpb/te...,11,3,telegraf-influxdb-grafana-docker
/cristianpb/telegraf-influxdb-grafana-docker/tree/master/docker,telegraf-influxdb-grafana-docker/docker at master 路 cristianpb/telegraf-influ...,6,3,telegraf-influxdb-grafana-docker
/cristianpb/telegraf-influxdb-grafana-docker/tree/master/docker/grafana,telegraf-influxdb-grafana-docker/docker/grafana at master 路 cristianpb/telegr...,5,2,telegraf-influxdb-grafana-docker
/cristianpb/telegraf-influxdb-grafana-docker/blob/master/docker/influxdb/influxdb.conf,telegraf-influxdb-grafana-docker/influxdb.conf at master 路 cristianpb/telegra...,3,2,telegraf-influxdb-grafana-docker
/cristianpb/telegraf-influxdb-grafana-docker/blob/master/docker/telegraf/telegraf.conf,telegraf-influxdb-grafana-docker/telegraf.conf at master 路 cristianpb/telegra...,3,2,telegraf-influxdb-grafana-docker
/cristianpb/telegraf-influxdb-grafana-docker/tree/master/docker/influxdb,telegraf-influxdb-grafana-docker/docker/influxdb at master 路 cristianpb/teleg...,3,2,telegraf-influxdb-grafana-docker
/cristianpb/telegraf-influxdb-grafana-docker/tree/master/docker/telegraf,telegraf-influxdb-grafana-docker/docker/telegraf at master 路 cristianpb/teleg...,3,2,telegraf-influxdb-grafana-docker
/cristianpb/telegraf-influxdb-grafana-docker/blob/master/docker/grafana/DashboardTelegraf.json,telegraf-influxdb-grafana-docker/DashboardTelegraf.json at master 路 cristianp...,3,1,telegraf-influxdb-grafana-docker
/cristianpb/telegraf-influxdb-grafana-docker/blob/master/docker/grafana/dashboard.yaml,telegraf-influxdb-grafana-docker/dashboard.yaml at master 路 cristianpb/telegr...,3,1,telegraf-influxdb-grafana-docker
/cristianpb/temp-sigfox,GitHub - cristianpb/temp-sigfox: Micropython code to send data from the ESP82...,3,1,temp-sigfox
/cristianpb/temp-sigfox/tree/master/arduino,temp-sigfox/arduino at master 路 cristianpb/temp-sigfox 路 GitHub,2,1,temp-sigfox
/cristianpb/temp-sigfox/blob/master/arduino/temp_onewire_sigfox.ino,temp-sigfox/temp_onewire_sigfox.ino at master 路 cristianpb/temp-sigfox 路 GitHub,1,1,temp-sigfox
/cristianpb/temp-sigfox/issues,Issues 路 cristianpb/temp-sigfox 路 GitHub,1,1,temp-sigfox
/cristianpb/temp-sigfox/pulls,Pull requests 路 cristianpb/temp-sigfox 路 GitHub,1,1,temp-sigfox
/cristianpb/temp-sigfox/tree/master/micropython,temp-sigfox/micropython at master 路 cristianpb/temp-sigfox 路 GitHub,1,1,temp-sigfox
/cristianpb/vimwiki,GitHub - cristianpb/vimwiki: My vimwiki,16,7,vimwiki
/cristianpb/vimwiki/tree/master/content,vimwiki/content at master 路 cristianpb/vimwiki 路 GitHub,8,2,vimwiki
/cristianpb/vimwiki/branches,Branches 路 cristianpb/vimwiki,7,1,vimwiki
/cristianpb/vimwiki/tree/master/layouts,vimwiki/layouts at master 路 cristianpb/vimwiki,5,3,vimwiki
/cristianpb/vimwiki/blob/master/config-gh.toml,vimwiki/config-gh.toml at master 路 cristianpb/vimwiki,4,2,vimwiki
/cristianpb/vimwiki/blob/master/config.toml,vimwiki/config.toml at master 路 cristianpb/vimwiki,4,2,vimwiki
/cristianpb/vimwiki/tree/gh-pages,cristianpb/vimwiki at gh-pages,4,1,vimwiki
/cristianpb/vimwiki/tree/master/assets/css,vimwiki/assets/css at master 路 cristianpb/vimwiki 路 GitHub,3,2,vimwiki
/cristianpb/vimwiki/tree/master/layouts/partials,vimwiki/layouts/partials at master 路 cristianpb/vimwiki,3,2,vimwiki
/cristianpb/vimwiki/blob/master/content/amp.md,vimwiki/amp.md at master 路 cristianpb/vimwiki,2,1,vimwiki
