path,title,count,uniques,repository
/cristianpb/analytics-google,GitHub - cristianpb/analytics-google: Google analytics from cristianpb.github...,4,3,analytics-google
/cristianpb/analytics-google/tree/master/.github/workflows,analytics-google/.github/workflows at master 路 cristianpb/analytics-google,2,1,analytics-google
/cristianpb/analytics-google/blob/master/.github/workflows/build.yml,analytics-google/build.yml at master 路 cristianpb/analytics-google,1,1,analytics-google
/cristianpb/cristianpb/actions,Actions 路 cristianpb/cristianpb,3,1,cristianpb
/cristianpb/cristianpb/actions/workflows/main.yml,Actions 路 cristianpb/cristianpb,2,1,cristianpb
/cristianpb/cristianpb/actions/runs/632214149, Add CI to update README 路 cristianpb/cristianpb@b618526,1,1,cristianpb
/cristianpb/cristianpb.github.io,cristianpb/cristianpb.github.io: My website,1,1,cristianpb.github.io
/cristianpb/dotfiles,GitHub - cristianpb/dotfiles: My dotfiles,32,11,dotfiles
/cristianpb/dotfiles/tree/master/ranger/.config/ranger,dotfiles/ranger/.config/ranger at master 路 cristianpb/dotfiles 路 GitHub,10,6,dotfiles
/cristianpb/dotfiles/blob/master/wiki2html.sh,dotfiles/wiki2html.sh at master 路 cristianpb/dotfiles 路 GitHub,7,4,dotfiles
/cristianpb/dotfiles/blob/master/vim/.vimrc,dotfiles/.vimrc at master 路 cristianpb/dotfiles 路 GitHub,7,3,dotfiles
/cristianpb/dotfiles/tree/master/vim,dotfiles/vim at master 路 cristianpb/dotfiles 路 GitHub,7,3,dotfiles
/cristianpb/dotfiles/blob/master/ranger/.config/ranger/commands.py,dotfiles/commands.py at master 路 cristianpb/dotfiles 路 GitHub,5,4,dotfiles
/cristianpb/dotfiles/blob/master/ranger/.config/ranger/rc.conf,dotfiles/rc.conf at master 路 cristianpb/dotfiles 路 GitHub,4,4,dotfiles
/cristianpb/dotfiles/blob/master/ranger/.config/ranger/scope.sh,dotfiles/scope.sh at master 路 cristianpb/dotfiles 路 GitHub,3,3,dotfiles
/cristianpb/dotfiles/tree/master/nvim/.config/nvim,dotfiles/nvim/.config/nvim at master 路 cristianpb/dotfiles 路 GitHub,2,2,dotfiles
/cristianpb/dotfiles/tree/master/ranger,dotfiles/ranger at master 路 cristianpb/dotfiles,2,2,dotfiles
/cristianpb/muse,GitHub - cristianpb/muse: Mopidy web client with Snapcast support,28,21,muse
/cristianpb/muse/issues,Issues 路 cristianpb/muse 路 GitHub,4,2,muse
/cristianpb/muse/blob/master/README.md,muse/README.md at master 路 cristianpb/muse 路 GitHub,2,2,muse
/cristianpb/muse/blob/master/setup.cfg,muse/setup.cfg at master 路 cristianpb/muse 路 GitHub,2,1,muse
/cristianpb/muse/blob/master/Makefile,muse/Makefile at master 路 cristianpb/muse,1,1,muse
/cristianpb/muse/blob/master/MANIFEST.in,muse/MANIFEST.in at master 路 cristianpb/muse 路 GitHub,1,1,muse
/cristianpb/muse/blob/master/mopidy_muse/mopidy.conf,muse/mopidy.conf at master 路 cristianpb/muse 路 GitHub,1,1,muse
/cristianpb/muse/commit/0b4fbeb48b0286799c14fa57e65f3e6eaf6314b8, Change name to Muse 路 cristianpb/muse@0b4fbeb 路 GitHub,1,1,muse
/cristianpb/muse/commits/master,Commits 路 cristianpb/muse 路 GitHub,1,1,muse
/cristianpb/muse/issues/20,Add options to play entire folders 路 Issue #20 路 cristianpb/muse,1,1,muse
/cristianpb/object-detection,"GitHub - cristianpb/object-detection: Object detection on Jetson Nano, Raspbe...",93,50,object-detection
/cristianpb/object-detection/tree/master/backend,object-detection/backend at master 路 cristianpb/object-detection 路 GitHub,36,17,object-detection
/cristianpb/object-detection/blob/master/backend/yolo_detection.py,object-detection/yolo_detection.py at master 路 cristianpb/object-detection 路 ...,25,20,object-detection
/cristianpb/object-detection/blob/master/backend/ssd_detection.py,object-detection/ssd_detection.py at master 路 cristianpb/object-detection 路 G...,15,12,object-detection
/cristianpb/object-detection/tree/master/models,object-detection/models at master 路 cristianpb/object-detection 路 GitHub,10,8,object-detection
/cristianpb/object-detection/search,Search 路 celery 路 GitHub,9,2,object-detection
/cristianpb/object-detection/blob/master/backend/camera.py,object-detection/camera.py at master 路 cristianpb/object-detection 路 GitHub,7,3,object-detection
/cristianpb/object-detection/blob/master/setup.py,object-detection/setup.py at master 路 cristianpb/object-detection 路 GitHub,6,5,object-detection
/cristianpb/object-detection/blob/master/backend/app.py,object-detection/app.py at master 路 cristianpb/object-detection 路 GitHub,6,4,object-detection
/cristianpb/object-detection/tree/master/imgs,object-detection/imgs at master 路 cristianpb/object-detection 路 GitHub,6,4,object-detection
/cristianpb/object-detection-frontend,GitHub - cristianpb/object-detection-frontend: Frontend Angular application f...,4,3,object-detection-frontend
/cristianpb/object-detection-frontend/tree/master/src,object-detection-frontend/src at master 路 cristianpb/object-detection-frontend,1,1,object-detection-frontend
/cristianpb/object-detection-frontend/tree/master/src/app,object-detection-frontend/src/app at master 路 cristianpb/object-detection-fro...,1,1,object-detection-frontend
/cristianpb/rhasspy-handler/issues/4,"""node index.js"" breaks with 'Error: Cannot find module 'onoff'' 路 Issue #4 路 ...",8,8,rhasspy-handler
/cristianpb/rhasspy-handler,GitHub - cristianpb/rhasspy-handler: My voice assistant intent handler,7,2,rhasspy-handler
/cristianpb/rhasspy-handler/tree/master/src,rhasspy-handler/src at master 路 cristianpb/rhasspy-handler 路 GitHub,3,1,rhasspy-handler
/cristianpb/rhasspy-handler/blob/master/src/index.ts,rhasspy-handler/index.ts at master 路 cristianpb/rhasspy-handler 路 GitHub,2,1,rhasspy-handler
/cristianpb/rhasspy-handler/blob/master/rhasspy/.config/rhasspy/profiles/es/kaldi_custom_words.txt,rhasspy-handler/kaldi_custom_words.txt at master 路 cristianpb/rhasspy-handler...,1,1,rhasspy-handler
/cristianpb/rhasspy-handler/blob/master/rhasspy/.config/rhasspy/profiles/es/slots/artist,rhasspy-handler/artist at master 路 cristianpb/rhasspy-handler 路 GitHub,1,1,rhasspy-handler
/cristianpb/rhasspy-handler/blob/master/src/alarms.ts,rhasspy-handler/alarms.ts at master 路 cristianpb/rhasspy-handler 路 GitHub,1,1,rhasspy-handler
/cristianpb/rhasspy-handler/blob/master/src/radios.ts,rhasspy-handler/radios.ts at master 路 cristianpb/rhasspy-handler 路 GitHub,1,1,rhasspy-handler
/cristianpb/rhasspy-handler/blob/master/src/rhasspymopidy.ts,rhasspy-handler/rhasspymopidy.ts at master 路 cristianpb/rhasspy-handler 路 Git...,1,1,rhasspy-handler
/cristianpb/rhasspy-handler/find/master,File Finder 路 GitHub,1,1,rhasspy-handler
/cristianpb/telegraf-influxdb-grafana-docker,"GitHub - cristianpb/telegraf-influxdb-grafana-docker: telegraf, influxdb and ...",10,5,telegraf-influxdb-grafana-docker
/cristianpb/telegraf-influxdb-grafana-docker/tree/master/docker,telegraf-influxdb-grafana-docker/docker at master 路 cristianpb/telegraf-influ...,7,4,telegraf-influxdb-grafana-docker
/cristianpb/telegraf-influxdb-grafana-docker/tree/master/docker/grafana,telegraf-influxdb-grafana-docker/docker/grafana at master 路 cristianpb/telegr...,6,3,telegraf-influxdb-grafana-docker
/cristianpb/telegraf-influxdb-grafana-docker/blob/master/docker-compose.yml,telegraf-influxdb-grafana-docker/docker-compose.yml at master 路 cristianpb/te...,5,3,telegraf-influxdb-grafana-docker
/cristianpb/telegraf-influxdb-grafana-docker/tree/master/docker/influxdb,telegraf-influxdb-grafana-docker/docker/influxdb at master 路 cristianpb/teleg...,5,3,telegraf-influxdb-grafana-docker
/cristianpb/telegraf-influxdb-grafana-docker/blob/master/docker/influxdb/influxdb.conf,telegraf-influxdb-grafana-docker/influxdb.conf at master 路 cristianpb/telegra...,4,2,telegraf-influxdb-grafana-docker
/cristianpb/telegraf-influxdb-grafana-docker/blob/master/Makefile,telegraf-influxdb-grafana-docker/Makefile at master 路 cristianpb/telegraf-inf...,3,3,telegraf-influxdb-grafana-docker
/cristianpb/telegraf-influxdb-grafana-docker/blob/master/docker/grafana/datasource.yaml,telegraf-influxdb-grafana-docker/datasource.yaml at master 路 cristianpb/teleg...,3,2,telegraf-influxdb-grafana-docker
/cristianpb/telegraf-influxdb-grafana-docker/blob/master/docker/grafana/DashboardTelegraf.json,telegraf-influxdb-grafana-docker/DashboardTelegraf.json at master 路 cristianp...,3,1,telegraf-influxdb-grafana-docker
/cristianpb/telegraf-influxdb-grafana-docker/blob/master/docker/grafana/dashboard.yaml,telegraf-influxdb-grafana-docker/dashboard.yaml at master 路 cristianpb/telegr...,3,1,telegraf-influxdb-grafana-docker
/cristianpb/temp-sigfox/tree/master/templates,temp-sigfox/templates at master 路 cristianpb/temp-sigfox,3,1,temp-sigfox
/cristianpb/temp-sigfox,cristianpb/temp-sigfox: Micropython code to send data from the ESP8266 using ...,1,1,temp-sigfox
/cristianpb/temp-sigfox/blob/master/templates/graph.js,temp-sigfox/graph.js at master 路 cristianpb/temp-sigfox,1,1,temp-sigfox
/cristianpb/temp-sigfox/blob/master/templates/graphSigfoxAPI.js,temp-sigfox/graphSigfoxAPI.js at master 路 cristianpb/temp-sigfox,1,1,temp-sigfox
/cristianpb/temp-sigfox/blob/master/templates/index.html,temp-sigfox/index.html at master 路 cristianpb/temp-sigfox,1,1,temp-sigfox
/cristianpb/vimwiki,GitHub - cristianpb/vimwiki: My vimwiki,20,9,vimwiki
/cristianpb/vimwiki/tree/master/content,vimwiki/content at master 路 cristianpb/vimwiki 路 GitHub,11,4,vimwiki
/cristianpb/vimwiki/tree/master/layouts,vimwiki/layouts at master 路 cristianpb/vimwiki 路 GitHub,7,3,vimwiki
/cristianpb/vimwiki/blob/master/content/index.md,vimwiki/index.md at master 路 cristianpb/vimwiki 路 GitHub,4,1,vimwiki
/cristianpb/vimwiki/blob/master/content/vimmd.md,vimwiki/vimmd.md at master 路 cristianpb/vimwiki 路 GitHub,3,2,vimwiki
/cristianpb/vimwiki/blob/master/config.toml,vimwiki/config.toml at master 路 cristianpb/vimwiki 路 GitHub,2,2,vimwiki
/cristianpb/vimwiki/tree/master/assets/css,vimwiki/assets/css at master 路 cristianpb/vimwiki 路 GitHub,2,2,vimwiki
/cristianpb/vimwiki/blob/master/content/_index.md,vimwiki/_index.md at master 路 cristianpb/vimwiki 路 GitHub,2,1,vimwiki
/cristianpb/vimwiki/blob/master/content/xrdp.md,vimwiki/xrdp.md at master 路 cristianpb/vimwiki,2,1,vimwiki
/cristianpb/vimwiki/blob/master/layouts/index.html,vimwiki/index.html at master 路 cristianpb/vimwiki 路 GitHub,2,1,vimwiki
