path,title,count,uniques,repository
/cristianpb/analytics-google,GitHub - cristianpb/analytics-google: Google analytics from cristianpb.github...,6,5,analytics-google
/cristianpb/analytics-google/blob/328f9fe42d7d1635f74023a5cc55b70a93c36065/src/routes/blog/_posts.js,analytics-google/_posts.js at 328f9fe42d7d1635f74023a5cc55b70a93c36065 路 cris...,1,1,analytics-google
/cristianpb/analytics-google/tree/master/cypress,analytics-google/cypress at master 路 cristianpb/analytics-google 路 GitHub,1,1,analytics-google
/cristianpb/dotfiles/tree/master/ranger/.config/ranger,dotfiles/ranger/.config/ranger at master 路 cristianpb/dotfiles 路 GitHub,17,5,dotfiles
/cristianpb/dotfiles,GitHub - cristianpb/dotfiles: My dotfiles,6,4,dotfiles
/cristianpb/dotfiles/blob/master/polybar/.config/polybar/config.ini,dotfiles/polybar/.config/polybar at master 路 cristianpb/dotfiles 路 GitHub,5,3,dotfiles
/cristianpb/dotfiles/blob/master/ranger/.config/ranger/commands.py,dotfiles/ranger/.config/ranger at master 路 cristianpb/dotfiles 路 GitHub,4,4,dotfiles
/cristianpb/dotfiles/blob/master/ranger/.config/ranger/rc.conf,dotfiles/rc.conf at master 路 cristianpb/dotfiles 路 GitHub,3,3,dotfiles
/cristianpb/dotfiles/tree/master/polybar/.config/polybar,GitHub - cristianpb/dotfiles: My dotfiles,3,2,dotfiles
/cristianpb/dotfiles/blob/master/ranger/.config/ranger/scope.sh,dotfiles/scope.sh at master 路 cristianpb/dotfiles 路 GitHub,1,1,dotfiles
/cristianpb/dotfiles/find/master,File Finder 路 GitHub,1,1,dotfiles
/cristianpb/dotfiles/search,Search 路 ranger color 路 GitHub,1,1,dotfiles
/cristianpb/dotfiles/tree/master/polybar/.config/polybar/scripts,dotfiles/polybar/.config/polybar at master 路 cristianpb/dotfiles 路 GitHub,1,1,dotfiles
/cristianpb/muse,GitHub - cristianpb/muse: Mopidy web client with Snapcast support,34,18,muse
/cristianpb/muse/actions/runs/121509959/workflow, Bump version automatically in package-lock.json 路 cristianpb/muse@80c3cb5,3,3,muse
/cristianpb/muse/blob/master/docker-compose.yml,muse/docker-compose.yml at master 路 cristianpb/muse 路 GitHub,2,2,muse
/cristianpb/muse/issues,GitHub - cristianpb/muse: Mopidy web client with Snapcast support,2,2,muse
/cristianpb/muse/tree/master/mopidy_muse,GitHub - cristianpb/muse: Mopidy web client with Snapcast support,2,1,muse
/cristianpb/muse/tree/master/src,muse/src at master 路 cristianpb/muse 路 GitHub,2,1,muse
/cristianpb/muse/blob/master/src/service-worker.js,muse/src at master 路 cristianpb/muse 路 GitHub,1,1,muse
/cristianpb/muse/pulls,Pull requests 路 cristianpb/muse 路 GitHub,1,1,muse
/cristianpb/muse/tree/master/cypress,Pull requests 路 cristianpb/muse 路 GitHub,1,1,muse
/cristianpb/muse/tree/master/mopidy_muse/static,muse/mopidy_muse at master 路 cristianpb/muse 路 GitHub,1,1,muse
/cristianpb/object-detection,object-detection/backend at master 路 cristianpb/object-detection 路 GitHub,62,28,object-detection
/cristianpb/object-detection/tree/master/backend,object-detection/yolo_detection.py at master 路 cristianpb/object-detection 路 ...,24,12,object-detection
/cristianpb/object-detection/blob/master/backend/yolo_detection.py,object-detection/yolo_detection.py at master 路 cristianpb/object-detection 路 ...,20,14,object-detection
/cristianpb/object-detection/blob/master/backend/ssd_detection.py,object-detection/ssd_detection.py at master 路 cristianpb/object-detection 路 G...,16,8,object-detection
/cristianpb/object-detection/tree/master/models,object-detection/models at master 路 cristianpb/object-detection,13,6,object-detection
/cristianpb/object-detection/deployments/activity_log,Deployments 路 cristianpb/object-detection,9,1,object-detection
/cristianpb/object-detection/tree/master/models/yolo,object-detection/models/yolo at master 路 cristianpb/object-detection,8,2,object-detection
/cristianpb/object-detection/tree/master/models/ssd_mobilenet,object-detection/models/ssd_mobilenet at master 路 cristianpb/object-detection...,7,3,object-detection
/cristianpb/object-detection/tree/master/imgs,object-detection/imgs/webcam at master 路 cristianpb/object-detection 路 GitHub,5,3,object-detection
/cristianpb/object-detection/blob/master/backend/motion.py,object-detection/motion.py at master 路 cristianpb/object-detection 路 GitHub,4,3,object-detection
/cristianpb/object-detection-frontend/tree/master/src/app,object-detection-frontend/src/app at master 路 cristianpb/object-detection-fro...,9,3,object-detection-frontend
/cristianpb/object-detection-frontend,object-detection-frontend/angular.json at master 路 cristianpb/object-detectio...,6,5,object-detection-frontend
/cristianpb/object-detection-frontend/tree/master/src,object-detection-frontend/src at master 路 cristianpb/object-detection-frontend,5,3,object-detection-frontend
/cristianpb/object-detection-frontend/tree/master/src/app/camera,object-detection-frontend/src/app/camera at master 路 cristianpb/object-detect...,5,3,object-detection-frontend
/cristianpb/object-detection-frontend/tree/master/src/app/workers,object-detection-frontend/src/app/workers at master 路 cristianpb/object-detec...,3,2,object-detection-frontend
/cristianpb/object-detection-frontend/blob/master/angular.json,object-detection-frontend/angular.json at master 路 cristianpb/object-detectio...,2,1,object-detection-frontend
/cristianpb/object-detection-frontend/pull/7,Bump karma from 5.0.9 to 6.3.16 by dependabot[bot] 路 Pull Request #7 路 cristi...,2,1,object-detection-frontend
/cristianpb/object-detection-frontend/pull/8,Pull requests 路 cristianpb/object-detection-frontend 路 GitHub,2,1,object-detection-frontend
/cristianpb/object-detection-frontend/pull/8/commits,Bump @angular/core from 10.2.5 to 11.0.5 by dependabot[bot] 路 Pull Request #8...,2,1,object-detection-frontend
/cristianpb/object-detection-frontend/pulls,Bump @angular/core from 10.2.5 to 11.0.5 by dependabot[bot] 路 Pull Request #8...,2,1,object-detection-frontend
/cristianpb/rhasspy-handler/issues/4,"""node index.js"" breaks with 'Error: Cannot find module 'onoff'' 路 Issue #4 路 ...",3,3,rhasspy-handler
/cristianpb/rhasspy-handler/tree/master/src,rhasspy-handler/src at master 路 cristianpb/rhasspy-handler 路 GitHub,2,1,rhasspy-handler
/cristianpb/rhasspy-handler,GitHub - cristianpb/rhasspy-handler: My voice assistant intent handler,1,1,rhasspy-handler
/cristianpb/rhasspy-handler/blob/master/src/index.ts,rhasspy-handler/index.ts at master 路 cristianpb/rhasspy-handler 路 GitHub,1,1,rhasspy-handler
/cristianpb/simple-streaming-gateway,cristianpb/simple-streaming-gateway: Flask App to stream generated sensor dat...,2,1,simple-streaming-gateway
/cristianpb/telegraf-influxdb-grafana-docker,"GitHub - cristianpb/telegraf-influxdb-grafana-docker: telegraf, influxdb and ...",33,13,telegraf-influxdb-grafana-docker
/cristianpb/telegraf-influxdb-grafana-docker/tree/master/docker,telegraf-influxdb-grafana-docker/docker at master 路 cristianpb/telegraf-influ...,11,3,telegraf-influxdb-grafana-docker
/cristianpb/telegraf-influxdb-grafana-docker/blob/master/docker-compose.yml,telegraf-influxdb-grafana-docker/docker-compose.yml at master 路 cristianpb/te...,7,5,telegraf-influxdb-grafana-docker
/cristianpb/telegraf-influxdb-grafana-docker/tree/master/docker/grafana,telegraf-influxdb-grafana-docker/docker/grafana at master 路 cristianpb/telegr...,4,2,telegraf-influxdb-grafana-docker
/cristianpb/telegraf-influxdb-grafana-docker/tree/master/docker/telegraf,telegraf-influxdb-grafana-docker/docker at master 路 cristianpb/telegraf-influ...,4,2,telegraf-influxdb-grafana-docker
/cristianpb/telegraf-influxdb-grafana-docker/blob/master/docker-compose-gpu.yml,telegraf-influxdb-grafana-docker/docker-compose-gpu.yml at master 路 cristianp...,2,2,telegraf-influxdb-grafana-docker
/cristianpb/telegraf-influxdb-grafana-docker/actions,Actions 路 cristianpb/telegraf-influxdb-grafana-docker 路 GitHub,2,1,telegraf-influxdb-grafana-docker
/cristianpb/telegraf-influxdb-grafana-docker/pulls,Pull requests 路 cristianpb/telegraf-influxdb-grafana-docker 路 GitHub,2,1,telegraf-influxdb-grafana-docker
/cristianpb/telegraf-influxdb-grafana-docker/blob/master/docker/grafana/DashboardTelegraf.json,telegraf-influxdb-grafana-docker/docker/grafana at master 路 cristianpb/telegr...,1,1,telegraf-influxdb-grafana-docker
/cristianpb/telegraf-influxdb-grafana-docker/blob/master/docker/grafana/datasource.yaml,telegraf-influxdb-grafana-docker/docker/grafana at master 路 cristianpb/telegr...,1,1,telegraf-influxdb-grafana-docker
/cristianpb/temp-sigfox,GitHub - cristianpb/temp-sigfox: Micropython code to send data from the ESP82...,1,1,temp-sigfox
/cristianpb/vimwiki,GitHub - cristianpb/vimwiki: My vimwiki,29,4,vimwiki
/cristianpb/vimwiki/tree/master/content,vimwiki/content at master 路 cristianpb/vimwiki,24,3,vimwiki
/cristianpb/vimwiki/tree/master/layouts,vimwiki/layouts at master 路 cristianpb/vimwiki,12,1,vimwiki
/cristianpb/vimwiki/tree/master/layouts/_default,vimwiki/layouts/_default at master 路 cristianpb/vimwiki,7,1,vimwiki
/cristianpb/vimwiki/tree/master/layouts/partials,vimwiki/layouts at master 路 cristianpb/vimwiki,7,1,vimwiki
/cristianpb/vimwiki/blob/master/config.toml,vimwiki/config.toml at master 路 cristianpb/vimwiki,6,1,vimwiki
/cristianpb/vimwiki/blob/master/content/_index.md,vimwiki/_index.md at master 路 cristianpb/vimwiki,6,1,vimwiki
/cristianpb/vimwiki/blob/master/config-gh.toml,vimwiki/config-gh.toml at master 路 cristianpb/vimwiki,4,1,vimwiki
/cristianpb/vimwiki/blob/master/README.md,vimwiki/README.md at master 路 cristianpb/vimwiki,4,1,vimwiki
/cristianpb/vimwiki/blob/master/layouts/index.html,vimwiki/layouts at master 路 cristianpb/vimwiki,3,1,vimwiki
