path,title,count,uniques,repository
/cristianpb/analytics-google,GitHub - cristianpb/analytics-google: Google analytics from cristianpb.github...,3,3,analytics-google
/cristianpb/analytics-google/blob/master/analytics.py,analytics-google/analytics.py at master 路 cristianpb/analytics-google,1,1,analytics-google
/cristianpb/cristianpb/actions,Actions 路 cristianpb/cristianpb,2,1,cristianpb
/cristianpb/cristianpb/actions/runs/852757317, Add CI to update README 路 cristianpb/cristianpb@b618526,2,1,cristianpb
/cristianpb/cristianpb,cristianpb/cristianpb,1,1,cristianpb
/cristianpb/cristianpb/actions/runs/853770758, Add CI to update README 路 cristianpb/cristianpb@b618526,1,1,cristianpb
/cristianpb/cristianpb.github.io,cristianpb/cristianpb.github.io: My website,1,1,cristianpb.github.io
/cristianpb/cristianpb.github.io/blob/master/gulpfile.js,cristianpb.github.io/gulpfile.js at master 路 cristianpb/cristianpb.github.io ...,1,1,cristianpb.github.io
/cristianpb/dotfiles,GitHub - cristianpb/dotfiles: My dotfiles,9,7,dotfiles
/cristianpb/dotfiles/blob/master/vim/.vimrc,dotfiles/.vimrc at master 路 cristianpb/dotfiles 路 GitHub,4,4,dotfiles
/cristianpb/dotfiles/blob/master/wiki2html.sh,dotfiles/wiki2html.sh at master 路 cristianpb/dotfiles,4,2,dotfiles
/cristianpb/dotfiles/blob/master/R/.Rprofile,dotfiles/.Rprofile at master 路 cristianpb/dotfiles 路 GitHub,2,1,dotfiles
/cristianpb/dotfiles/tree/master/R,dotfiles/R at master 路 cristianpb/dotfiles 路 GitHub,2,1,dotfiles
/cristianpb/dotfiles/blob/master/checkmail.sh,dotfiles/checkmail.sh at master 路 cristianpb/dotfiles 路 GitHub,1,1,dotfiles
/cristianpb/dotfiles/blob/master/msmtp/.msmtprc,dotfiles/.msmtprc at master 路 cristianpb/dotfiles,1,1,dotfiles
/cristianpb/dotfiles/tree/master/ncmpcpp/.ncmpcpp,dotfiles/ncmpcpp/.ncmpcpp at master 路 cristianpb/dotfiles 路 GitHub,1,1,dotfiles
/cristianpb/dotfiles/tree/master/ranger/.config/ranger,dotfiles/ranger/.config/ranger at master 路 cristianpb/dotfiles 路 GitHub,1,1,dotfiles
/cristianpb/muse,GitHub - cristianpb/muse: Mopidy web client with Snapcast support,15,11,muse
/cristianpb/muse/issues/4,How to get snapcast control working? 路 Issue #4 路 cristianpb/muse 路 GitHub,2,1,muse
/cristianpb/muse/blob/master/Dockerfile,muse/Dockerfile at master 路 cristianpb/muse 路 GitHub,1,1,muse
/cristianpb/muse/blob/master/mopidy_muse/__init__.py,muse/__init__.py at master 路 cristianpb/muse 路 GitHub,1,1,muse
/cristianpb/muse/issues,Issues 路 cristianpb/muse 路 GitHub,1,1,muse
/cristianpb/muse/tree/master/mopidy_muse,muse/mopidy_muse at master 路 cristianpb/muse 路 GitHub,1,1,muse
/cristianpb/muse/tree/master/mopidy_muse/static,muse/mopidy_muse/static at master 路 cristianpb/muse 路 GitHub,1,1,muse
/cristianpb/muse/tree/master/src,muse/src at master 路 cristianpb/muse 路 GitHub,1,1,muse
/cristianpb/muse/tree/master/src/components,muse/src/components at master 路 cristianpb/muse 路 GitHub,1,1,muse
/cristianpb/muse/tree/master/src/routes,muse/src/routes at master 路 cristianpb/muse 路 GitHub,1,1,muse
/cristianpb/object-detection,"GitHub - cristianpb/object-detection: Object detection on Jetson Nano, Raspbe...",30,24,object-detection
/cristianpb/object-detection/blob/master/backend/yolo_detection.py,object-detection/yolo_detection.py at master 路 cristianpb/object-detection 路 ...,17,15,object-detection
/cristianpb/object-detection/blob/master/backend/ssd_detection.py,object-detection/ssd_detection.py at master 路 cristianpb/object-detection 路 G...,13,11,object-detection
/cristianpb/object-detection/blob/master/backend/motion.py,object-detection/motion.py at master 路 cristianpb/object-detection 路 GitHub,6,6,object-detection
/cristianpb/object-detection/tree/master/backend,object-detection/backend at master 路 cristianpb/object-detection 路 GitHub,4,4,object-detection
/cristianpb/object-detection/blob/master/backend/ssd_trt_detection.py,object-detection/ssd_trt_detection.py at master 路 cristianpb/object-detection...,2,2,object-detection
/cristianpb/object-detection/tree/master/models,object-detection/models at master 路 cristianpb/object-detection 路 GitHub,2,2,object-detection
/cristianpb/object-detection/tree/master/systemd,object-detection/systemd at master 路 cristianpb/object-detection,2,2,object-detection
/cristianpb/object-detection/blob/master/backend/app.py,object-detection/app.py at master 路 cristianpb/object-detection 路 GitHub,1,1,object-detection
/cristianpb/object-detection/blob/master/backend/base_camera.py,object-detection/base_camera.py at master 路 cristianpb/object-detection 路 Git...,1,1,object-detection
/cristianpb/object-detection-frontend,GitHub - cristianpb/object-detection-frontend: Frontend Angular application f...,6,4,object-detection-frontend
/cristianpb/object-detection-frontend/tree/master/src,object-detection-frontend/src at master 路 cristianpb/object-detection-frontend,2,1,object-detection-frontend
/cristianpb/object-detection-frontend/tree/master/e2e,object-detection-frontend/e2e at master 路 cristianpb/object-detection-frontend,1,1,object-detection-frontend
/cristianpb/object-detection-frontend/tree/master/.github/workflows,object-detection-frontend/.github/workflows at master 路 cristianpb/object-det...,1,1,object-detection-frontend
/cristianpb/rhasspy-handler/issues/4,"""node index.js"" breaks with 'Error: Cannot find module 'onoff'' 路 Issue #4 路 ...",9,9,rhasspy-handler
/cristianpb/rhasspy-handler,GitHub - cristianpb/rhasspy-handler: My voice assistant intent handler,1,1,rhasspy-handler
/cristianpb/stats/blob/gh-pages/github-referrers.csv,stats/github-referrers.csv at gh-pages 路 cristianpb/stats,4,1,stats
/cristianpb/stats,cristianpb/stats,1,1,stats
/cristianpb/stats/branches,Branches 路 cristianpb/stats,1,1,stats
/cristianpb/stats/tree/gh-pages,cristianpb/stats at gh-pages,1,1,stats
/cristianpb/telegraf-influxdb-grafana-docker,"GitHub - cristianpb/telegraf-influxdb-grafana-docker: telegraf, influxdb and ...",2,2,telegraf-influxdb-grafana-docker
/cristianpb/telegraf-influxdb-grafana-docker/blob/master/docker-compose.yml,telegraf-influxdb-grafana-docker/docker-compose.yml at master 路 cristianpb/te...,2,2,telegraf-influxdb-grafana-docker
/cristianpb/telegraf-influxdb-grafana-docker/blob/master/docker/grafana/DashboardTelegraf.json,telegraf-influxdb-grafana-docker/DashboardTelegraf.json at master 路 cristianp...,2,2,telegraf-influxdb-grafana-docker
/cristianpb/telegraf-influxdb-grafana-docker/blob/master/docker/grafana/dashboard.yaml,telegraf-influxdb-grafana-docker/dashboard.yaml at master 路 cristianpb/telegr...,2,2,telegraf-influxdb-grafana-docker
/cristianpb/telegraf-influxdb-grafana-docker/blob/master/docker/influxdb/influxdb.conf,telegraf-influxdb-grafana-docker/influxdb.conf at master 路 cristianpb/telegra...,2,2,telegraf-influxdb-grafana-docker
/cristianpb/telegraf-influxdb-grafana-docker/tree/master/docker,telegraf-influxdb-grafana-docker/docker at master 路 cristianpb/telegraf-influ...,2,2,telegraf-influxdb-grafana-docker
/cristianpb/telegraf-influxdb-grafana-docker/tree/master/docker/grafana,telegraf-influxdb-grafana-docker/docker/grafana at master 路 cristianpb/telegr...,2,2,telegraf-influxdb-grafana-docker
/cristianpb/telegraf-influxdb-grafana-docker/tree/master/docker/influxdb,telegraf-influxdb-grafana-docker/docker/influxdb at master 路 cristianpb/teleg...,2,2,telegraf-influxdb-grafana-docker
/cristianpb/telegraf-influxdb-grafana-docker/blob/master/docker/grafana/datasource.yaml,telegraf-influxdb-grafana-docker/datasource.yaml at master 路 cristianpb/teleg...,1,1,telegraf-influxdb-grafana-docker
/cristianpb/telegraf-influxdb-grafana-docker/blob/master/docker/influxdb/types.db,telegraf-influxdb-grafana-docker/types.db at master 路 cristianpb/telegraf-inf...,1,1,telegraf-influxdb-grafana-docker
/cristianpb/temp-sigfox,cristianpb/temp-sigfox: Micropython code to send data from the ESP8266 using ...,1,1,temp-sigfox
/cristianpb/temp-sigfox/blob/master/micropython/boot.py,temp-sigfox/boot.py at master 路 cristianpb/temp-sigfox,1,1,temp-sigfox
/cristianpb/temp-sigfox/tree/master/micropython,temp-sigfox/micropython at master 路 cristianpb/temp-sigfox,1,1,temp-sigfox
/cristianpb/vimwiki/tree/master/content,vimwiki/content at master 路 cristianpb/vimwiki,7,2,vimwiki
/cristianpb/vimwiki,cristianpb/vimwiki: My vimwiki,5,2,vimwiki
/cristianpb/vimwiki/blob/master/config.toml,vimwiki/config.toml at master 路 cristianpb/vimwiki,4,2,vimwiki
/cristianpb/vimwiki/tree/master/layouts,vimwiki/layouts at master 路 cristianpb/vimwiki,4,2,vimwiki
/cristianpb/vimwiki/blob/master/config-gh.toml,vimwiki/config-gh.toml at master 路 cristianpb/vimwiki,3,2,vimwiki
/cristianpb/vimwiki/blob/master/content/nginx.md,vimwiki/nginx.md at master 路 cristianpb/vimwiki 路 GitHub,3,1,vimwiki
/cristianpb/vimwiki/tree/master/layouts/_default,vimwiki/layouts/_default at master 路 cristianpb/vimwiki,2,1,vimwiki
/cristianpb/vimwiki/blob/master/assets/css/dark.css,vimwiki/dark.css at master 路 cristianpb/vimwiki 路 GitHub,1,1,vimwiki
/cristianpb/vimwiki/blob/master/content/amp.md,vimwiki/amp.md at master 路 cristianpb/vimwiki 路 GitHub,1,1,vimwiki
/cristianpb/vimwiki/blob/master/content/remote.it,vimwiki/remote.it at master 路 cristianpb/vimwiki 路 GitHub,1,1,vimwiki
