path,title,count,uniques,repository
/cristianpb/analytics-google,GitHub - cristianpb/analytics-google: Google analytics from cristianpb.github...,4,4,analytics-google
/cristianpb/cristianpb.github.io/blob/19bd84508e3d59989e2e9f9d8cdc6eb2aef1433a/assets/img/runner-up/04-Multiple_Trainning.ipynb,cristianpb.github.io/04-Multiple_Trainning.ipynb at 19bd84508e3d59989e2e9f9d8...,8,1,cristianpb.github.io
/cristianpb/cristianpb.github.io,cristianpb/cristianpb.github.io: My website,6,1,cristianpb.github.io
/cristianpb/cristianpb.github.io/tree/master/_data,cristianpb.github.io/_data at master 路 cristianpb/cristianpb.github.io,2,1,cristianpb.github.io
/cristianpb/cristianpb.github.io/tree/master/_data/marathon,cristianpb.github.io/_data/marathon at master 路 cristianpb/cristianpb.github.io,2,1,cristianpb.github.io
/cristianpb/cristianpb.github.io/commit/9f68d399535ffb27512a9577fd1a91365c03ba80, Use gists to save jupyter notebooks 路 cristianpb/cristianpb.github.io@9f68...,1,1,cristianpb.github.io
/cristianpb/cristianpb.github.io/commits/master,Commits 路 cristianpb/cristianpb.github.io,1,1,cristianpb.github.io
/cristianpb/cristianpb.github.io/tree/master/assets,cristianpb.github.io/assets at master 路 cristianpb/cristianpb.github.io,1,1,cristianpb.github.io
/cristianpb/cristianpb.github.io/tree/master/_includes,cristianpb.github.io/_includes at master 路 cristianpb/cristianpb.github.io,1,1,cristianpb.github.io
/cristianpb/cristianpb.github.io/tree/master/_layouts,cristianpb.github.io/_layouts at master 路 cristianpb/cristianpb.github.io,1,1,cristianpb.github.io
/cristianpb/dotfiles,GitHub - cristianpb/dotfiles: My dotfiles,11,9,dotfiles
/cristianpb/dotfiles/tree/master/ranger/.config/ranger,dotfiles/ranger/.config/ranger at master 路 cristianpb/dotfiles 路 GitHub,7,2,dotfiles
/cristianpb/dotfiles/blob/master/vim/.vimrc,dotfiles/.vimrc at master 路 cristianpb/dotfiles 路 GitHub,6,2,dotfiles
/cristianpb/dotfiles/blob/master/xorg/.Xresources.dark,dotfiles/.Xresources.dark at master 路 cristianpb/dotfiles 路 GitHub,5,2,dotfiles
/cristianpb/dotfiles/tree/master/ranger/.config,dotfiles/ranger/.config at master 路 cristianpb/dotfiles 路 GitHub,5,1,dotfiles
/cristianpb/dotfiles/tree/master/xorg,dotfiles/xorg at master 路 cristianpb/dotfiles 路 GitHub,4,2,dotfiles
/cristianpb/dotfiles/blob/master/mutt/.muttrc,dotfiles/.muttrc at master 路 cristianpb/dotfiles 路 GitHub,1,1,dotfiles
/cristianpb/dotfiles/blob/master/nvim/.config/nvim/coc-settings.json,dotfiles/coc-settings.json at master 路 cristianpb/dotfiles,1,1,dotfiles
/cristianpb/dotfiles/blob/master/nvim/.config/nvim/init.vim,dotfiles/init.vim at master 路 cristianpb/dotfiles,1,1,dotfiles
/cristianpb/dotfiles/blob/master/ranger/.config/ranger/commands.py,dotfiles/commands.py at master 路 cristianpb/dotfiles 路 GitHub,1,1,dotfiles
/cristianpb/muse,GitHub - cristianpb/muse: Mopidy web client with Snapcast support,22,17,muse
/cristianpb/muse/issues,Issues 路 cristianpb/muse 路 GitHub,4,4,muse
/cristianpb/muse/tree/master/src,muse/src at master 路 cristianpb/muse,3,1,muse
/cristianpb/muse/actions/runs/121509959/workflow, Bump version automatically in package-lock.json 路 cristianpb/muse@80c3cb5 ...,2,2,muse
/cristianpb/muse/blob/b709e95519d76d15cc76dd7fbe01e92b558a016d/cypress/integration/spec.js,muse/spec.js at b709e95519d76d15cc76dd7fbe01e92b558a016d 路 cristianpb/muse,1,1,muse
/cristianpb/muse/blob/b709e95519d76d15cc76dd7fbe01e92b558a016d/src/routes/search.svelte,muse/search.svelte at b709e95519d76d15cc76dd7fbe01e92b558a016d 路 cristianpb/m...,1,1,muse
/cristianpb/muse/blob/b709e95519d76d15cc76dd7fbe01e92b558a016d/src/server.js,muse/server.js at b709e95519d76d15cc76dd7fbe01e92b558a016d 路 cristianpb/muse,1,1,muse
/cristianpb/muse/blob/master/Dockerfile,muse/Dockerfile at master 路 cristianpb/muse 路 GitHub,1,1,muse
/cristianpb/muse/blob/master/.github/workflows/publish.yml,muse/publish.yml at master 路 cristianpb/muse,1,1,muse
/cristianpb/muse/blob/master/package.json,muse/package.json at master 路 cristianpb/muse,1,1,muse
/cristianpb/object-detection,"GitHub - cristianpb/object-detection: Object detection on Jetson Nano, Raspbe...",70,36,object-detection
/cristianpb/object-detection/blob/master/backend/ssd_detection.py,object-detection/ssd_detection.py at master 路 cristianpb/object-detection 路 G...,24,15,object-detection
/cristianpb/object-detection/blob/master/backend/yolo_detection.py,object-detection/yolo_detection.py at master 路 cristianpb/object-detection 路 ...,23,18,object-detection
/cristianpb/object-detection/tree/master/backend,object-detection/backend at master 路 cristianpb/object-detection 路 GitHub,10,5,object-detection
/cristianpb/object-detection/tree/master/models,object-detection/models at master 路 cristianpb/object-detection 路 GitHub,6,4,object-detection
/cristianpb/object-detection/tree/master/imgs,object-detection/imgs at master 路 cristianpb/object-detection 路 GitHub,5,3,object-detection
/cristianpb/object-detection/tree/master/nginx,object-detection/nginx at master 路 cristianpb/object-detection 路 GitHub,4,2,object-detection
/cristianpb/object-detection/blob/master/requirements.txt,object-detection/requirements.txt at master 路 cristianpb/object-detection 路 G...,3,2,object-detection
/cristianpb/object-detection/tree/master/tests,object-detection/tests at master 路 cristianpb/object-detection 路 GitHub,3,2,object-detection
/cristianpb/object-detection/tree/master/models/yolo,object-detection/models/yolo at master 路 cristianpb/object-detection 路 GitHub,2,2,object-detection
/cristianpb/object-detection-frontend,GitHub - cristianpb/object-detection-frontend: Frontend Angular application f...,10,6,object-detection-frontend
/cristianpb/object-detection-frontend/blob/master/.github/workflows/nodejs.yml,object-detection-frontend/nodejs.yml at master 路 cristianpb/object-detection-...,3,2,object-detection-frontend
/cristianpb/object-detection-frontend/blob/master/README.md,object-detection-frontend/README.md at master 路 cristianpb/object-detection-f...,1,1,object-detection-frontend
/cristianpb/object-detection-frontend/tree/master/.github/workflows,object-detection-frontend/.github/workflows at master 路 cristianpb/object-det...,1,1,object-detection-frontend
/cristianpb/object-detection-frontend/tree/master/src,object-detection-frontend/src at master 路 cristianpb/object-detection-fronten...,1,1,object-detection-frontend
/cristianpb/rhasspy-handler/issues/4,"""node index.js"" breaks with 'Error: Cannot find module 'onoff'' 路 Issue #4 路 ...",5,5,rhasspy-handler
/cristianpb/rhasspy-handler/blob/9a9a9ce05f1345a024a9a8d1568181d60c626ca2/src/%40types/mopidy.d.ts,rhasspy-handler/mopidy.d.ts at 9a9a9ce05f1345a024a9a8d1568181d60c626ca2 路 cri...,1,1,rhasspy-handler
/cristianpb/telegraf-influxdb-grafana-docker,"GitHub - cristianpb/telegraf-influxdb-grafana-docker: telegraf, influxdb and ...",9,8,telegraf-influxdb-grafana-docker
/cristianpb/telegraf-influxdb-grafana-docker/blob/master/docker-compose.yml,telegraf-influxdb-grafana-docker/docker-compose.yml at master 路 cristianpb/te...,7,7,telegraf-influxdb-grafana-docker
/cristianpb/telegraf-influxdb-grafana-docker/network/members,Forks 路 cristianpb/telegraf-influxdb-grafana-docker,4,1,telegraf-influxdb-grafana-docker
/cristianpb/telegraf-influxdb-grafana-docker/tree/master/docker,telegraf-influxdb-grafana-docker/docker at master 路 cristianpb/telegraf-influ...,3,3,telegraf-influxdb-grafana-docker
/cristianpb/telegraf-influxdb-grafana-docker/tree/master/docker/telegraf,telegraf-influxdb-grafana-docker/docker/telegraf at master 路 cristianpb/teleg...,3,3,telegraf-influxdb-grafana-docker
/cristianpb/telegraf-influxdb-grafana-docker/blob/master/docker/influxdb/influxdb.conf,telegraf-influxdb-grafana-docker/influxdb.conf at master 路 cristianpb/telegra...,2,2,telegraf-influxdb-grafana-docker
/cristianpb/telegraf-influxdb-grafana-docker/blob/master/docker/influxdb/types.db,telegraf-influxdb-grafana-docker/types.db at master 路 cristianpb/telegraf-inf...,2,2,telegraf-influxdb-grafana-docker
/cristianpb/telegraf-influxdb-grafana-docker/blob/master/docker/telegraf/telegraf.conf,telegraf-influxdb-grafana-docker/telegraf.conf at master 路 cristianpb/telegra...,2,2,telegraf-influxdb-grafana-docker
/cristianpb/telegraf-influxdb-grafana-docker/tree/master/docker/grafana,telegraf-influxdb-grafana-docker/docker/grafana at master 路 cristianpb/telegr...,2,2,telegraf-influxdb-grafana-docker
/cristianpb/telegraf-influxdb-grafana-docker/tree/master/docker/influxdb,telegraf-influxdb-grafana-docker/docker/influxdb at master 路 cristianpb/teleg...,2,2,telegraf-influxdb-grafana-docker
/cristianpb/temp-sigfox,GitHub - cristianpb/temp-sigfox: Micropython code to send data from the ESP82...,1,1,temp-sigfox
/cristianpb/vimwiki,cristianpb/vimwiki: My vimwiki,3,1,vimwiki
/cristianpb/vimwiki/tree/master/assets,vimwiki/assets at master 路 cristianpb/vimwiki,1,1,vimwiki
/cristianpb/vimwiki/tree/master/assets/css,vimwiki/assets/css at master 路 cristianpb/vimwiki,1,1,vimwiki
/cristianpb/vimwiki/tree/master/content,vimwiki/content at master 路 cristianpb/vimwiki,1,1,vimwiki
/cristianpb/vimwiki/tree/master/layouts,vimwiki/layouts at master 路 cristianpb/vimwiki,1,1,vimwiki
