path,title,count,uniques,repository
/cristianpb/analytics-google,GitHub - cristianpb/analytics-google: Google analytics from cristianpb.github...,5,5,analytics-google
/cristianpb/analytics-google/blob/master/README.md,analytics-google/README.md at master 路 cristianpb/analytics-google 路 GitHub,1,1,analytics-google
/cristianpb/analytics-google/commits/master,Commits 路 cristianpb/analytics-google 路 GitHub,1,1,analytics-google
/cristianpb/dotfiles/tree/master/vim,dotfiles/vim at master 路 cristianpb/dotfiles 路 GitHub,4,1,dotfiles
/cristianpb/dotfiles,GitHub - cristianpb/dotfiles: My dotfiles,3,3,dotfiles
/cristianpb/dotfiles/tree/master/nvim/.config/nvim,dotfiles/nvim/.config/nvim at master 路 cristianpb/dotfiles 路 GitHub,3,1,dotfiles
/cristianpb/dotfiles/tree/master/polybar/.config/polybar,dotfiles/polybar/.config/polybar at master 路 cristianpb/dotfiles 路 GitHub,3,1,dotfiles
/cristianpb/dotfiles/blob/master/nvim/.config/nvim/init.vim,dotfiles/init.vim at master 路 cristianpb/dotfiles 路 GitHub,2,1,dotfiles
/cristianpb/dotfiles/blob/master/sxiv/.config/sxiv/exec/image-info,dotfiles/sxiv/.config/sxiv/exec/image-info at master 路 cristianpb/dotfiles 路 ...,2,1,dotfiles
/cristianpb/dotfiles/blob/master/vim/.vimrc,dotfiles/.vimrc at master 路 cristianpb/dotfiles 路 GitHub,2,1,dotfiles
/cristianpb/dotfiles/tree/master/ranger/.config/ranger,dotfiles/ranger/.config/ranger at master 路 cristianpb/dotfiles 路 GitHub,2,1,dotfiles
/cristianpb/dotfiles/blob/master/mbsync/.mbsyncrc,dotfiles/mbsync/.mbsyncrc at master 路 cristianpb/dotfiles 路 GitHub,1,1,dotfiles
/cristianpb/dotfiles/blob/master/ranger/.config/ranger/rc.conf,dotfiles/ranger/.config/ranger/rc.conf at master 路 cristianpb/dotfiles 路 GitHub,1,1,dotfiles
/cristianpb/muse,GitHub - cristianpb/muse: Mopidy web client with Snapcast support,9,8,muse
/cristianpb/muse/blob/master/docker-compose.yml,muse/docker-compose.yml at master 路 cristianpb/muse 路 GitHub,3,2,muse
/cristianpb/muse/issues,Issues 路 cristianpb/muse 路 GitHub,1,1,muse
/cristianpb/music-s3,GitHub - cristianpb/music-s3,4,2,music-s3
/cristianpb/music-s3/actions,Actions 路 cristianpb/music-s3 路 GitHub,2,1,music-s3
/cristianpb/music-s3/actions/workflows/main.yaml,Actions 路 cristianpb/music-s3 路 GitHub,2,1,music-s3
/cristianpb/music-s3/actions/runs/5284591417,Workflow 路 cristianpb/music-s3@2e0a087 路 GitHub,1,1,music-s3
/cristianpb/music-s3/actions/runs/5284591417/jobs/9562177533,Workflow 路 cristianpb/music-s3@2e0a087 路 GitHub,1,1,music-s3
/cristianpb/music-s3/commit/ade3eaf07c66a194af9ea3482fe4ec7a41661619, Update playlist 路 cristianpb/music-s3@ade3eaf 路 GitHub,1,1,music-s3
/cristianpb/music-s3/tree/master/.github/workflows,music-s3/.github/workflows at master 路 cristianpb/music-s3 路 GitHub,1,1,music-s3
/cristianpb/object-detection,"GitHub - cristianpb/object-detection: Object detection on Jetson Nano, Raspbe...",15,13,object-detection
/cristianpb/object-detection/blob/master/backend/yolo_detection.py,object-detection/backend/yolo_detection.py at master 路 cristianpb/object-dete...,10,6,object-detection
/cristianpb/object-detection/tree/master/backend,object-detection/backend at master 路 cristianpb/object-detection 路 GitHub,10,5,object-detection
/cristianpb/object-detection/blob/master/backend/ssd_detection.py,object-detection/backend/ssd_detection.py at master 路 cristianpb/object-detec...,6,4,object-detection
/cristianpb/object-detection/blob/master/backend/camera.py,object-detection/backend/camera.py at master 路 cristianpb/object-detection 路 ...,3,1,object-detection
/cristianpb/object-detection/blob/master/backend/app.py,object-detection/backend/app.py at master 路 cristianpb/object-detection 路 Git...,2,1,object-detection
/cristianpb/object-detection/blob/master/backend/base_camera.py,object-detection/backend/base_camera.py at master 路 cristianpb/object-detecti...,2,1,object-detection
/cristianpb/object-detection/tree/master/models,object-detection/models at master 路 cristianpb/object-detection 路 GitHub,2,1,object-detection
/cristianpb/object-detection/tree/master/models/yolo,object-detection/models/yolo at master 路 cristianpb/object-detection 路 GitHub,2,1,object-detection
/cristianpb/object-detection/actions,Actions 路 cristianpb/object-detection 路 GitHub,1,1,object-detection
/cristianpb/object-detection-frontend,GitHub - cristianpb/object-detection-frontend: Frontend Angular application f...,3,3,object-detection-frontend
/cristianpb/rhasspy-handler/issues/4,"""node index.js"" breaks with 'Error: Cannot find module 'onoff'' 路 Issue #4 路 ...",1,1,rhasspy-handler
/cristianpb/telegraf-influxdb-grafana-docker/blob/master/docker-compose.yml,telegraf-influxdb-grafana-docker/docker-compose.yml at master 路 cristianpb/te...,15,7,telegraf-influxdb-grafana-docker
/cristianpb/telegraf-influxdb-grafana-docker,"GitHub - cristianpb/telegraf-influxdb-grafana-docker: telegraf, influxdb and ...",13,9,telegraf-influxdb-grafana-docker
/cristianpb/telegraf-influxdb-grafana-docker/tree/master/docker,telegraf-influxdb-grafana-docker/docker at master 路 cristianpb/telegraf-influ...,6,4,telegraf-influxdb-grafana-docker
/cristianpb/telegraf-influxdb-grafana-docker/blob/master/Makefile,telegraf-influxdb-grafana-docker/Makefile at master 路 cristianpb/telegraf-inf...,5,3,telegraf-influxdb-grafana-docker
/cristianpb/telegraf-influxdb-grafana-docker/blob/master/.env_dist,telegraf-influxdb-grafana-docker/.env_dist at master 路 cristianpb/telegraf-in...,5,2,telegraf-influxdb-grafana-docker
/cristianpb/telegraf-influxdb-grafana-docker/blob/master/docker/influxdb/influxdb.conf,telegraf-influxdb-grafana-docker/docker/influxdb/influxdb.conf at master 路 cr...,3,1,telegraf-influxdb-grafana-docker
/cristianpb/telegraf-influxdb-grafana-docker/tree/master/docker/influxdb,telegraf-influxdb-grafana-docker/docker/influxdb at master 路 cristianpb/teleg...,3,1,telegraf-influxdb-grafana-docker
/cristianpb/telegraf-influxdb-grafana-docker/blob/master/docker/telegraf/telegraf.conf,telegraf-influxdb-grafana-docker/docker/telegraf/telegraf.conf at master 路 cr...,2,2,telegraf-influxdb-grafana-docker
/cristianpb/telegraf-influxdb-grafana-docker/tree/master/docker/grafana,telegraf-influxdb-grafana-docker/docker/grafana at master 路 cristianpb/telegr...,2,2,telegraf-influxdb-grafana-docker
/cristianpb/telegraf-influxdb-grafana-docker/tree/master/docker/telegraf,telegraf-influxdb-grafana-docker/docker/telegraf at master 路 cristianpb/teleg...,2,2,telegraf-influxdb-grafana-docker
/cristianpb/vimwiki,cristianpb/vimwiki: My vimwiki,1,1,vimwiki
