path,title,count,uniques,repository
/cristianpb/analytics-google,GitHub - cristianpb/analytics-google: Google analytics from cristianpb.github...,13,8,analytics-google
/cristianpb/analytics-google/blob/master/analytics.py,analytics-google/analytics.py at master 路 cristianpb/analytics-google,1,1,analytics-google
/cristianpb/cristianpb,cristianpb/cristianpb,1,1,cristianpb
/cristianpb/cristianpb.github.io,GitHub - cristianpb/cristianpb.github.io: My website,3,2,cristianpb.github.io
/cristianpb/cristianpb.github.io/blob/master/_config.yml,cristianpb.github.io/_config.yml at master 路 cristianpb/cristianpb.github.io,1,1,cristianpb.github.io
/cristianpb/cristianpb.github.io/commit/c12ac972bdbf03d882e841adc61993d32709396c, Patch for magic wand article 路 cristianpb/cristianpb.github.io@c12ac97,1,1,cristianpb.github.io
/cristianpb/cristianpb.github.io/tree/master/jekyll_collections,cristianpb.github.io/jekyll_collections at master 路 cristianpb/cristianpb.git...,1,1,cristianpb.github.io
/cristianpb/cristianpb.github.io/tree/master/jekyll_collections/_posts,cristianpb.github.io/jekyll_collections/_posts at master 路 cristianpb/cristia...,1,1,cristianpb.github.io
/cristianpb/dotfiles,GitHub - cristianpb/dotfiles: My dotfiles,15,9,dotfiles
/cristianpb/dotfiles/blob/master/vim/.vimrc,dotfiles/.vimrc at master 路 cristianpb/dotfiles,6,5,dotfiles
/cristianpb/dotfiles/tree/master/vim,dotfiles/vim at master 路 cristianpb/dotfiles,4,3,dotfiles
/cristianpb/dotfiles/blob/master/polybar/.config/polybar/config,dotfiles/config at master 路 cristianpb/dotfiles,3,1,dotfiles
/cristianpb/dotfiles/tree/master/ranger/.config/ranger,dotfiles/ranger/.config/ranger at master 路 cristianpb/dotfiles,2,2,dotfiles
/cristianpb/dotfiles/tree/master/bash,dotfiles/bash at master 路 cristianpb/dotfiles,2,1,dotfiles
/cristianpb/dotfiles/tree/master/notmuch,dotfiles/notmuch at master 路 cristianpb/dotfiles,2,1,dotfiles
/cristianpb/dotfiles/tree/master/polybar/.config/polybar,dotfiles/polybar/.config/polybar at master 路 cristianpb/dotfiles,2,1,dotfiles
/cristianpb/dotfiles/blob/master/autolock.sh,dotfiles/autolock.sh at master 路 cristianpb/dotfiles,1,1,dotfiles
/cristianpb/dotfiles/blob/master/bash/.bash_profile,dotfiles/.bash_profile at master 路 cristianpb/dotfiles,1,1,dotfiles
/cristianpb/muse,GitHub - cristianpb/muse: Mopidy web client with Snapcast support,26,22,muse
/cristianpb/muse/issues,Issues 路 cristianpb/muse 路 GitHub,5,3,muse
/cristianpb/muse/actions,Actions 路 cristianpb/muse 路 GitHub,2,2,muse
/cristianpb/muse/actions/runs/121509959/workflow, Bump version automatically in package-lock.json 路 cristianpb/muse@80c3cb5,2,2,muse
/cristianpb/muse/blob/master/docker-compose.yml,muse/docker-compose.yml at master 路 cristianpb/muse 路 GitHub,2,2,muse
/cristianpb/muse/pulls,Pull requests 路 cristianpb/muse,2,2,muse
/cristianpb/muse/pulse,Pulse 路 cristianpb/muse,2,2,muse
/cristianpb/muse/blob/master/Dockerfile,muse/Dockerfile at master 路 cristianpb/muse 路 GitHub,2,1,muse
/cristianpb/muse/actions/runs/1156504306, Add static files for web server of snapcast 路 cristianpb/muse@4223136 路 Gi...,1,1,muse
/cristianpb/muse/blob/master/Dockerfile-base,muse/Dockerfile-base at master 路 cristianpb/muse 路 GitHub,1,1,muse
/cristianpb/object-detection,"GitHub - cristianpb/object-detection: Object detection on Jetson Nano, Raspbe...",53,40,object-detection
/cristianpb/object-detection/actions,Actions 路 cristianpb/object-detection,35,3,object-detection
/cristianpb/object-detection/blob/master/backend/ssd_detection.py,object-detection/ssd_detection.py at master 路 cristianpb/object-detection 路 G...,20,17,object-detection
/cristianpb/object-detection/blob/master/backend/yolo_detection.py,object-detection/yolo_detection.py at master 路 cristianpb/object-detection 路 ...,19,15,object-detection
/cristianpb/object-detection/tree/master/backend,object-detection/backend at master 路 cristianpb/object-detection 路 GitHub,19,7,object-detection
/cristianpb/object-detection/tree/master/models,object-detection/models at master 路 cristianpb/object-detection 路 GitHub,11,7,object-detection
/cristianpb/object-detection/tree/master/models/ssd_mobilenet,object-detection/models/ssd_mobilenet at master 路 cristianpb/object-detection...,8,5,object-detection
/cristianpb/object-detection/blob/master/backend/app.py,object-detection/app.py at master 路 cristianpb/object-detection 路 GitHub,6,3,object-detection
/cristianpb/object-detection/tree/master/models/yolo,object-detection/models/yolo at master 路 cristianpb/object-detection 路 GitHub,4,4,object-detection
/cristianpb/object-detection/tree/master/systemd,object-detection/systemd at master 路 cristianpb/object-detection 路 GitHub,4,3,object-detection
/cristianpb/object-detection-frontend,GitHub - cristianpb/object-detection-frontend: Frontend Angular application f...,16,9,object-detection-frontend
/cristianpb/object-detection-frontend/tree/master/src,object-detection-frontend/src at master 路 cristianpb/object-detection-fronten...,3,3,object-detection-frontend
/cristianpb/object-detection-frontend/actions,Actions 路 cristianpb/object-detection-frontend,1,1,object-detection-frontend
/cristianpb/object-detection-frontend/actions/runs/1191794955, Add Dockerfile for dev environment 路 cristianpb/object-detection-frontend@...,1,1,object-detection-frontend
/cristianpb/object-detection-frontend/blob/master/.github/workflows/nodejs.yml,object-detection-frontend/nodejs.yml at master 路 cristianpb/object-detection-...,1,1,object-detection-frontend
/cristianpb/object-detection-frontend/branches,Branches 路 cristianpb/object-detection-frontend 路 GitHub,1,1,object-detection-frontend
/cristianpb/object-detection-frontend/pulse,Pulse 路 cristianpb/object-detection-frontend,1,1,object-detection-frontend
/cristianpb/object-detection-frontend/security,Security Overview 路 cristianpb/object-detection-frontend,1,1,object-detection-frontend
/cristianpb/object-detection-frontend/security/code-scanning,Code scanning alerts 路 cristianpb/object-detection-frontend,1,1,object-detection-frontend
/cristianpb/object-detection-frontend/security/dependabot,Dependabot alerts 路 cristianpb/object-detection-frontend,1,1,object-detection-frontend
/cristianpb/rhasspy-handler/issues/4,"""node index.js"" breaks with 'Error: Cannot find module 'onoff'' 路 Issue #4 路 ...",4,4,rhasspy-handler
/cristianpb/rhasspy-handler,GitHub - cristianpb/rhasspy-handler: My voice assistant intent handler,1,1,rhasspy-handler
/cristianpb/rhasspy-handler/blob/master/src/radios.ts,rhasspy-handler/radios.ts at master 路 cristianpb/rhasspy-handler 路 GitHub,1,1,rhasspy-handler
/cristianpb/rhasspy-handler/blob/master/src/rhasspymopidy.ts,rhasspy-handler/rhasspymopidy.ts at master 路 cristianpb/rhasspy-handler 路 Git...,1,1,rhasspy-handler
/cristianpb/rhasspy-handler/tree/master/src,rhasspy-handler/src at master 路 cristianpb/rhasspy-handler 路 GitHub,1,1,rhasspy-handler
/cristianpb/stats,cristianpb/stats,1,1,stats
/cristianpb/telegraf-influxdb-grafana-docker,"GitHub - cristianpb/telegraf-influxdb-grafana-docker: telegraf, influxdb and ...",26,12,telegraf-influxdb-grafana-docker
/cristianpb/telegraf-influxdb-grafana-docker/blob/master/docker-compose.yml,telegraf-influxdb-grafana-docker/docker-compose.yml at master 路 cristianpb/te...,18,8,telegraf-influxdb-grafana-docker
/cristianpb/telegraf-influxdb-grafana-docker/tree/master/docker,telegraf-influxdb-grafana-docker/docker at master 路 cristianpb/telegraf-influ...,18,6,telegraf-influxdb-grafana-docker
/cristianpb/telegraf-influxdb-grafana-docker/tree/master/docker/grafana,telegraf-influxdb-grafana-docker/docker/grafana at master 路 cristianpb/telegr...,11,6,telegraf-influxdb-grafana-docker
/cristianpb/telegraf-influxdb-grafana-docker/tree/master/docker/influxdb,telegraf-influxdb-grafana-docker/docker/influxdb at master 路 cristianpb/teleg...,7,1,telegraf-influxdb-grafana-docker
/cristianpb/telegraf-influxdb-grafana-docker/blob/master/docker/grafana/datasource.yaml,telegraf-influxdb-grafana-docker/datasource.yaml at master 路 cristianpb/teleg...,6,3,telegraf-influxdb-grafana-docker
/cristianpb/telegraf-influxdb-grafana-docker/blob/master/docker/grafana/DashboardTelegraf.json,telegraf-influxdb-grafana-docker/DashboardTelegraf.json at master 路 cristianp...,5,3,telegraf-influxdb-grafana-docker
/cristianpb/telegraf-influxdb-grafana-docker/blob/master/docker/influxdb/influxdb.conf,telegraf-influxdb-grafana-docker/influxdb.conf at master 路 cristianpb/telegra...,5,1,telegraf-influxdb-grafana-docker
/cristianpb/telegraf-influxdb-grafana-docker/blob/master/.env_dist,telegraf-influxdb-grafana-docker/.env_dist at master 路 cristianpb/telegraf-in...,3,3,telegraf-influxdb-grafana-docker
/cristianpb/telegraf-influxdb-grafana-docker/find/master,File Finder 路 GitHub,3,2,telegraf-influxdb-grafana-docker
/cristianpb/temp-sigfox,GitHub - cristianpb/temp-sigfox: Micropython code to send data from the ESP82...,1,1,temp-sigfox
/cristianpb/vimwiki,GitHub - cristianpb/vimwiki: My vimwiki,10,3,vimwiki
/cristianpb/vimwiki/tree/master/assets/css,vimwiki/assets/css at master 路 cristianpb/vimwiki,6,1,vimwiki
/cristianpb/vimwiki/tree/master/layouts,vimwiki/layouts at master 路 cristianpb/vimwiki,5,1,vimwiki
/cristianpb/vimwiki/tree/master/layouts/_default,vimwiki/layouts/_default at master 路 cristianpb/vimwiki,4,1,vimwiki
/cristianpb/vimwiki/tree/master/content,vimwiki/content at master 路 cristianpb/vimwiki 路 GitHub,3,2,vimwiki
/cristianpb/vimwiki/tree/master/.github/workflows,vimwiki/.github/workflows at master 路 cristianpb/vimwiki,3,1,vimwiki
/cristianpb/vimwiki/blob/master/config.toml,vimwiki/config.toml at master 路 cristianpb/vimwiki 路 GitHub,2,2,vimwiki
/cristianpb/vimwiki/blob/master/content/ubuntu.md,vimwiki/ubuntu.md at master 路 cristianpb/vimwiki 路 GitHub,2,2,vimwiki
/cristianpb/vimwiki/blob/master/layouts/_default/baseof.html,vimwiki/baseof.html at master 路 cristianpb/vimwiki,2,1,vimwiki
/cristianpb/vimwiki/blob/a708b071108e6bc2565a23b118cc2bfdfd116286/content/remote.it,vimwiki/remote.it at a708b071108e6bc2565a23b118cc2bfdfd116286 路 cristianpb/vi...,1,1,vimwiki
